REG.CGE;NÚMERO;ÓRGÃO;CONVENENTE;CELEBRAÇÃO;PUBLICAÇÃO;OBJETO;VIGÊNCIA;VALOR TOTAL
08-90304-2;0223/2008;SEE - 22.0001 - SECRETARIA DE ESTADO DA EDUCAÇÃO;CONSELHO ESCOLAR DA EEEF IRMÃ STEFANIE- CAMPINA GRANDE;1/4/2008;1/5/2008;AQUISIÇÃO DE GÊNEROS ALIMENTÍCIOS,A TÍTULO DE SUPLEMENTAÇÃO NO FORNECIMENTO DE ALIMENTAÇÃO ESCOLAR NAS ESCOLAS DE TEMPO INTEGRAL;31/12/2008;50.508,0
08-90088-4; 001/2008;FAC - 27.0202 - FUNDAÇÃO DE AÇÃO COMUNITÁRIA;ASSOCIAÇÃO BENEFICENTE DO COMPLEXO DO BAIRRO DE JOSÉ PINHEIRO;1/3/2008;12/3/2008;TRANSFERÊNCIA DE RECURSOS PARA AUXILIAR NA REALIZAÇÃO DO PROJETO SOPA DA FAMÍLIA.;31/12/2008;13.120,0
08-90058-2;0012/2008;FUNCEP - 20.901 - FUNDO DE COMBATE E ERRADICAÇÃO À POBREZA DO ESTADO;FUNDAÇÃO ASSISTENCIAL DA PARAÍBA  -  FAP;15/2/2008;21/2/2008;AQUISIÇÃO DE MEDICAMENTOS QUIMIOTERAPIA ULISSE PINTO,DA FACULDADE ASSISTENCIAL DA PARAÍBA - FAP.;15/2/2009;600.000,0
08-90007-8;0001/2008;PBTUR 21.0201 - EMPRESA PARAIBANA DE TURISMO S/A;VISÃO NACIONAL CONSCIÊCIA CRISTÃ/CAMPINA GRANDE;23/1/2008;26/1/2008;CONSTITUI APOIO AO EVENTO DENOMINADO ENCONTRO PARA CONSCIÊNCIA CRISTÃ,NO PERÍODO DE 30 DE JANEIRO A 05 DE FEVEREIRO DE 2008.;31/3/2008;160.000,0
07-91112-2;0030/2007;UEPB - 22.0401 - UNIVERSIDADE ESTADUAL DA PARAÍBA;PREFEITURA MUNICIPAL DE CAMPINA GRANDE;18/10/2007;28/12/2007;CONCESSÃO DE ESTÁGIOS CURRICULARES E ELETIVOS AOS ALUNOS REGULAMENTE MATRICULADOS E COM EFETIVA FREQUÊNCIA.;18/10/2011;0,0
07-91101-7;0025/2007;SEJEL - 07.0001 - SECRETARIA DE ESTADO DA JUVENTUDE,ESPORTE E LAZER;CENTRO DESENV.ATIV.FÍSICA SAÚDE/CIDADANIA/CAMPINA GRANDE;14/12/2007;26/12/2007;PROMOVER A XIII CORRIDA TELES DE ALBUQUERQUE EM CAMPINA GRANDE/PB.;14/1/2008;37.250,0
"07-91071-1;0027/2007;SES - 25.0001 - SECRETARIA DE ESTADO DA SAÚDE;ONG - ESPERANÇA NO AMANHÃ - ENA;7/12/2007;17/12/2007;REALIZAÇÃO DO PROJETO ""CASA DE APOIO ESPERANÇA NO AMANHÃ"";6/3/2008;7.500,0
07-91068-1;0023/2007;SES - 25.0001 - SECRETARIA DE ESTADO DA SAÚDE;REDE NACIONAL PESQUISA AO VIRUS HIV - AIDS / CAMPINA GRANDE;7/12/2007;17/12/2007;REALIZAÇÃO DO PROJETO CASA DE APOIO CÉLIA BRECHÓ.;6/3/2008;7.500,0
"07-91064-9;0017/2007;SES - 25.0001 - SECRETARIA DE ESTADO DA SAÚDE;GRUPO DE APOIO A VIDA - GAV - CAMPINA GRANDE/PB.;20/11/2007;17/12/2007;REALIZAÇÃO DO PROJETO ""VHIVENDO COM CIDADANIA POSITHIVA"" NESTE ESTADO.;19/6/2008;30.840,11
07-91058-4;0088/2007;FUNCEP - 20.901 - FUNDO DE COMBATE E ERRADICAÇÃO À POBREZA DO ESTADO;CASA DE CARIDADE PADRE IBIAPINA;3/12/2007;17/12/2007;MANUTENÇÃO DO PROGRAMA DE ATENDIMENTO A CRIANÇAS E ADOLESCENTES VIVENDO EM SITUAÇÃO DE RISCO SOCIAL E PESSOAL EM REGIME DE SEMI-INTERNATO.;16/1/2009;34.300,0
