REG.CGE;NÚMERO;ÓRGÃO;CONVENENTE;CELEBRAÇÃO;PUBLICAÇÃO;OBJETO;VIGÊNCIA;VALOR TOTAL
"07-91047-9;0018/2007;SES - 25.0001 - SECRETARIA DE ESTADO DA SAÚDE;REDE NACIONAL PESQUISA AO VIRUS HIV - AIDS / CAMPINA GRANDE;22/11/2007;17/12/2007;REALIZAÇÃO DO PROJETO ""INCLUSÃO SOCIAL PELA PROFISSIONALIZAÇÃO"" NESTE ESTADO.;22/7/2008;30.840,0
07-91045-2;0239/2007;SEE - 22.0001 - SECRETARIA DE ESTADO DA EDUCAÇÃO;CONSELHO ESCOLAR DA ENE EMÍDIO VIANA CORREIA;21/11/2007;17/12/2007;EXECUÇÃO DE AÇÕES DE MANUTENÇÃO DAS ATIVIDADES ESCOLARES VISANDO A MELHORIA DA QUALIDADE DO ENSINO OFERECIDO AOS ALUNOS DO ENSINO MÉDIO.;30/3/2008;12.624,0
07-91034-7;0659/2007;SEE - 22.0001 - SECRETARIA DE ESTADO DA EDUCAÇÃO;CONSELHO ESCOLAR DA EEEFM NENZINHA CUNHA LIMA;20/11/2007;17/12/2007;CUSTEAR O TRANSPORTE DE ALUNOS DA REDE ESTADUAL DE ENSINO RESIDENTE EM ÁREAS RURAIS.;31/12/2007;50.000,0
07-91032-1;0012/2007;CINEP - 21.0101 - CIA DE DESENVOLVIMENTO DA PARAÍBA;UNIVERSIDADE ESTADUAL DA PARAÍBA;14/11/2007;17/12/2007;CONCESSÃO DE ESTÁGIOS CURRICULARES AO ESTUANTES REGULAMENTE MATRICULADOS E COM EFETIVA FREQUENCIAS.;14/11/2011;0,0
07-91026-6;0003/2007;SUDEMA - 31.205 - SUPERINTENDÊNCIA DA ADMINISTRAÇÃO DO MEIO AMBIENTE;UNIVERSIDADE FEDERAL DE CAMPINA GRANDE - PB.;19/11/2007;17/12/2007;CONCESSÃO DE ESTÁGIOS CURRICULARES AO ESTUANTES REGULAMENTE MATRICULADOS E COM EFETIVA FREQUENCIAS.;19/11/2014;0,0
07-91021-5;0007/2007;FAC - 27.0202 - FUNDAÇÃO DE AÇÃO COMUNITÁRIA;GRUPO DE VOLUNTÁRIOS DE CAMPINA GRANDE / CAMPINA GRANDE;26/10/2007;17/12/2007;CONFECÇÃO DOS TRABALHOS MANUAIS DESENVOLVIDOS PELO GRUPO DE VOLUNTÁRIAS INTEGRANTES DA ASSOCIAÇÃO,INCENTIVANDO A PRÁTICA DE TRABLHO ARTESANAIS.  ;31/12/2007;30.000,0
07-91007-0;0126/2007;CEHAP - 31.204 - COMPANHIA ESTADUAL DE HABITAÇÃO POPULAR;ASSOCIAÇÃO BENEFICENTE DO COMPLEXO DO BAIRRO DE JOSÉ PINHEIRO;;;BENEFICIAR ATÉ 28 (VINTE E OITO) FAMÍLIAS PARA A MANUTENÇÃO,RECUPERAÇÃO,REFORMA OU AMPLIAÇÃO DE IMÓVEL PERTENCENTE AOS PRÓPRIOS BENEFICIÁRIOS.;1/4/2009;42.000,0
07-91005-3;0131/2007;CEHAP - 31.204 - COMPANHIA ESTADUAL DE HABITAÇÃO POPULAR;ASSOCIAÇÃO DOS PEQUENOS PRODUTORES RURAIS DO DISTRITO DE GALANTE;;;BENEFICIAR ATÉ 07 (SETE) FAMÍLIAS PARA A MANUTENÇÃO,RECUPERAÇÃO,REFORMA OU AMPLIAÇÃO DE IMÓVEL PERTENCENTE AOS PRÓPRIOS BENEFICIÁRIOS.;1/4/2009;42.000,0
07-91004-5;0129/2007;CEHAP - 31.204 - COMPANHIA ESTADUAL DE HABITAÇÃO POPULAR;CLUBE DE MÃE DO CAPIM GRANDE HOSANA CONSTANTINO;;;BENEFICIAR ATÉ 12 (DOZE) FAMÍLIAS PARA A MANUTENÇÃO,RECUPERAÇÃO,REFORMA OU AMPLIAÇÃO DE IMÓVEL PERTENCENTE AOS PRÓPRIOS BENEFICIÁRIOS.;1/4/2009;72.000,0
07-91003-7;0130/2007;CEHAP - 31.204 - COMPANHIA ESTADUAL DE HABITAÇÃO POPULAR;CLUBE DE MÃE DO CAPIM GRANDE HOSANA CONSTANTINO;;;BENEFICIAR ATÉ 28 (VINTE E OITO) FAMÍLIAS PARA A MANUTENÇÃO,RECUPERAÇÃO,REFORMA OU AMPLIAÇÃO DE IMÓVEL PERTENCENTE AOS PRÓPRIOS BENEFICIÁRIOS.;1/4/2009;42.000,0
07-91002-9;0127/2007;CEHAP - 31.204 - COMPANHIA ESTADUAL DE HABITAÇÃO POPULAR;ASSOCIAÇÃO BENEFICENTE DO COMPLEXO DO BAIRRO DE JOSÉ PINHEIRO;;;BENEFICIAR ATÉ 02 (DUAS) FAMÍLIAS PARA A MANUTENÇÃO,RECUPERAÇÃO,REFORMA OU AMPLIAÇÃO DE IMÓVEL PERTENCENTE AOS PRÓPRIOS BENEFICIÁRIOS.;1/4/2009;12.000,0
07-91001-1;0128/2007;CEHAP - 31.204 - COMPANHIA ESTADUAL DE HABITAÇÃO POPULAR;ASSOCIAÇÃO DOS PEQUENOS PRODUTORES RURAIS DO DISTRITO DE GALANTE;;;BENEFICIAR ATÉ 13 (TREZE) FAMÍLIAS PARA A MANUTENÇÃO,RECUPERAÇÃO,REFORMA OU AMPLIAÇÃO DE IMÓVEL PERTENCENTE AOS PRÓPRIOS BENEFICIÁRIOS.;1/4/2009;19.500,0
07-91000-2;0133/2007;CEHAP - 31.204 - COMPANHIA ESTADUAL DE HABITAÇÃO POPULAR;ASSOCIAÇÃO AMPLITUDE RURAL DOS MORADORES DO JENIPAPO;;;BENEFICIAR ATÉ 10 (DEZ) FAMÍLIAS PARA A MANUTENÇÃO,RECUPERAÇÃO,REFORMA OU AMPLIAÇÃO DE IMÓVEL PERTENCENTE AOS PRÓPRIOS BENEFICIÁRIOS.;2/4/2009;60.000,0
07-90999-3;0132/2007;CEHAP - 31.204 - COMPANHIA ESTADUAL DE HABITAÇÃO POPULAR;ASSOCIAÇÃO AMPLITUDE RURAL DOS MORADORES DO JENIPAPO;;;BENEFICIAR ATÉ 20 (VINTE) FAMÍLIAS PARA A MANUTENÇÃO,RECUPERAÇÃO,REFORMA OU AMPLIAÇÃO DE IMÓVEL PERTENCENTE AOS PRÓPRIOS BENEFICIÁRIOS.;2/4/2009;30.000,0
07-90997-7;0134/2007;CEHAP - 31.204 - COMPANHIA ESTADUAL DE HABITAÇÃO POPULAR;CLUBE DE MÃE CRISTINA PROCÓPIO;;;BENEFICIAR ATÉ 40 (QUARENTA) FAMÍLIAS PARA A MANUTENÇÃO,RECUPERAÇÃO,REFORMA OU AMPLIAÇÃO DE IMÓVEL PERTENCENTE AOS PRÓPRIOS BENEFICIÁRIOS.;2/4/2009;60.000,0
07-90992-6;0013/2007;SES - 25.0001 - SECRETARIA DE ESTADO DA SAÚDE;REDE NACIONAL PESQUISA AO VIRUS HIV - AIDS / CAMPINA GRANDE;;11/11/2007;PROJETO CONSTRUINDO A CIDADANIA DE PORTADORES DE HIV/AIDS NESTE ESTADO.;15/6/2008;30.000,0
07-90979-9;0011/2007;CINEP - 21.0101 - CIA DE DESENVOLVIMENTO DA PARAÍBA;SOCIEDADE RURAL DA PARAÍBA - SRPB;;30/10/2007;REALIZAÇÃO DE SERVIÇOS DE BENFEITORIAS NAS ESTRUTURAS FÍSICAS DO PARQUE DE EXPOSIÇÃO CARLOS PESSOA FILHO EM CAMPINA GRANDE/PB.;30/12/2007;44.000,0
07-90952-7;0579/2007;SEE - 22.0001 - SECRETARIA DE ESTADO DA EDUCAÇÃO;ASSOC. DE PAIS E AMIGOS EXEPICIONAIS DE CAMPINA GRANDE;;11/10/2007;VISANDO EXPANSÃO E MELHORIA DO ENSINO COM VISTA A CUSTEAR A APAE-CG EM SUA MANUTENÇÃO,PARA DAR CONTINUIDADE AO PROGRAMA PARA REABILITAÇÃO DOS PORTADORES DE DEFICIÊNCIA.;31/12/2007;90.000,0
07-90944-6;0040/2007;SEDH - 27.0001 - SECRETARIA DE ESTADO DO DESENVOLVIMENTO HUMANO;CLUBE DE MÃES NAIR PEREIRA LIMA/CAMPINA GRANDE;;9/10/2007;PROJETO ÁGUA PARA TODOS.;31/12/2007;96.030,0
07-90889-0;0005/2007;SEDAP - 32.101 - SECRETARIA DE ESTADO DE DESENV AGROPECUÁRIA E PESCA;SOCIEDADE RURAL DA PARAÍBA - SRPB;;19/9/2007;REALIZAÇÃO DA 45ª. EXPAPI - EXPOSIÇÃO PARAÍBANA DE ANIMAIS E PRODUTOS INDUSTRIAIS A REALIZAR-SE ENTRE OS DIAS 16 E 23 DE SETEMBRO DE 2007 EM CAMPINA GRANDE/PB.;30/11/2007;143.000,0
07-90856-3;0063/2007;FUNCEP - 20.901 - FUNDO DE COMBATE E ERRADICAÇÃO À POBREZA DO ESTADO;FUNDAÇÃO ASSISTENCIAL DA PARAÍBA  -  FAP;;5/9/2007;AQUISIÇÃO DE UM ACELERADOR LINEAR PARA O CENTRO DE CANCEROLOGIA DO HOSPITAL DA FUNDAÇÃO ASSITENCIAL DA PARAÍBA - FAP.;31/3/2010;1.807.603,66
07-90827-0;0096/2007;CEHAP - 31.204 - COMPANHIA ESTADUAL DE HABITAÇÃO POPULAR;CLUBE DE MÃES NAIR PEREIRA LIMA/CAMPINA GRANDE;;26/9/2007;ATENDIMENTO DE DEMANDAS POR HABITAÇÃO PARA FAMÍLIAS DE BAIXA RENDA,VISANDO A BENEFICIAR ATÉ 22 (VINTE E DUAS) FAMÍLIAS PARA CONSTRUÇÃO DE HABITAÇÃO EM LOTES.;3/2/2009;33.000,0
07-90824-5;0097/2007;CEHAP - 31.204 - COMPANHIA ESTADUAL DE HABITAÇÃO POPULAR;CLUBE DE MÃES NAIR PEREIRA LIMA/CAMPINA GRANDE;;25/9/2007;ATENDIMENTO DE DEMANDAS POR HABITAÇÃO PARA FAMÍLIAS DE BAIXA RENDA,VISANDO A BENEFICIAR ATÉ 18 (DEZOITO) FAMÍLIAS PARA CONSTRUÇÃO DE HABITAÇÃO EM LOTES.;3/2/2009;108.000,0
07-90813-0;0240/2007;SEE - 22.0001 - SECRETARIA DE ESTADO DA EDUCAÇÃO;CONSELHO ESCOLAR WALNIZA BORBOREMA CUNHA LIMA - CAMPINA GRANDE/PB.;;15/8/2007;EXECUÇÃO DE AÇÕES DE MANUTENÇÃO DAS ATIVIDADES ESCOLARES VISANDO Á MELHORIA DA QUALIDADE DO ENSINO OFERECIDO AOS ALUNOS DO ENSINO MÉDIO.;30/3/2008;300,0
07-90806-7;0029/2007;AESA - 31.208 - AGÊNCIA EXEC. DE GESTÃO DAS ÁGUAS DO ESTADO DA PARAIBA;UNIVERSIDADE FEDERAL DE CAMPINA GRANDE - PB.;;21/8/2007;CONCESSÃO DE ESTÁGIOS CURRICULARES AOS ESTUDANTES REGULAMENTES MATRICULADOS COM EFETIVA FREQUÊNCIA NA DISCIPLINA CURRICULAR DO RESPECTIVO CURSO.;29/6/2011;0,0
07-90800-8;0006/2007;CINEP - 21.0101 - CIA DE DESENVOLVIMENTO DA PARAÍBA;SERVIÇO BRASILEIRO DE AGENTES DA CIDADANIA - SEBAC;;15/8/2007;REALIZAÇÃO DE CURSOS PROFISSIONALIZANTES PARA A CAPACITAÇÃO DE MÃO-DE-OBRA INDUSTRIAL ÁS COMUNIDADES CARENTES DO MUNICÍPIO DE CAMPINA GRANDE/PB.;1/3/2008;29.090,0
07-90797-4;0010/2007;UEPB - 22.0401 - UNIVERSIDADE ESTADUAL DA PARAÍBA;SÃO PAULO ALPARGATAS S/A;;15/8/2007;CONCESSÃO DE ESTÁGIOS CURRICULARES AOS ESTUDANTES REGULAMENTES MATRICULADOS COM EFETIVA FREQUÊNCIA NA DISCIPLINA CURRICULAR DO RESPECTIVO CURSO.;21/5/2010;0,0
07-90774-5;0S/N 2007;SEE - 22.0001 - SECRETARIA DE ESTADO DA EDUCAÇÃO;UNIVERSIDADE ESTADUAL DA PARAÍBA;;4/8/2007;IMPLEMENTAÇÃO DO PROGRAMA SABERES DA TERRA EM SETE MUNICÍPIOS.PARAIBANOS ARAÇAGI,AREIA,ARARUNA,COREMAS,ITABAIANA,MULUNGÚ,E PILÕES.;31/12/2007;0,0
07-90771-1;0S/N 2007;SEE - 22.0001 - SECRETARIA DE ESTADO DA EDUCAÇÃO;UNIVERSIDADE FEDERAL DE CAMPINA GRANDE - PB.;;4/8/2007;IMPLEMENTAÇÃO DO PROGRAMA SABERES DA TERRA EM SETE MUNICÍPIOS.PARAIBANOS ARAÇAGI,AREIA,ARARUNA,COREMAS,ITABAIANA,MULUNGÚ,E PILÕES.;31/12/2007;0,0
07-90749-4;0002/2007;FUNESC - 33.201 - FUNDAÇÃO ESPAÇO CULTURAL DA PARAÍBA;ASSOC. DOS MÚSICOS DA ORQUESTRA SANFÔNICA RONALDO CUNHA LIMA/ CAMPINA GRANDE;;3/8/2007;CUSTEAR AS DESPESAS DA ORQUESTRA SANFÔNICA RONALDO CUNHA LIMA REMUNERANDO OS SEUS COMPONENTES PARA DESLOCAMENTO,DESPESAS PESSOAIS E MANUTENÇÃO DOS INSTRUMENTOS.;31/12/2007;180.000,0
07-90743-5;0004/2007;SETDE - 21.0001 - SECRETARIA DE ESTADO DO TURISMO E DESENVOLVIMENTO ECONÔMICO;CÂMERA DIRIGENTES LOJISTAS - CDL / CAMPINA GRANDE;;20/7/2007;VISANDO A PARTICIPAÇÃO DA SETDE NA CAMPANHA LIQUIDA CAMPINA 2007 QUE  REALIZAR-SE-Á NO PERÍODO DE 05 Á 14 DE JULHO  DE 2007 NO MUNICÍPIO DE CAMPINA GRANDE/PB.;30/9/2007;140.000,0
07-90727-3;0236/2007;SEE - 22.0001 - SECRETARIA DE ESTADO DA EDUCAÇÃO;CONSELHO ESCOLAR DA ESCOLA EST. DE ENS. FUND. E MÉDIO ELPIDIO DE ALMEIDA- CAMPINA GRANDE;;20/7/2007;EXECUÇÃO DE AÇÕES DE MANUTENÇÃO DAS ATIVIDADES ESCOLARES VISANDO Á MELHORIA DA QUALIDADE DO ENSINO OFERECIDO AOS ALUNOS DO ENSINO MÉDIO.;30/3/2008;34.932,0
07-90634-0;0535/2007;SEE - 22.0001 - SECRETARIA DE ESTADO DA EDUCAÇÃO;CONSELHO EWCOLAR DA EEEFM MONTE CARMELO - CAMPINA GRANDE/PB.;;22/6/2007;CUSTEAR O TRANSPORTE DE ALUNOS DA REDE ESTADUAL DE ENSINO RESIDENTE EM ÁREAS RURAIS.;31/12/2007;40.500,0
07-90632-3;0534/2007;SEE - 22.0001 - SECRETARIA DE ESTADO DA EDUCAÇÃO;CONSELHO ESCOLAR DA EEEFM NOSSA SENHORA APARECIDA/CAMPINA GRANDE;;22/6/2007;CUSTEAR O TRANSPORTE DE ALUNOS DA REDE ESTADUAL DE ENSINO RESIDENTE EM ÁREAS RURAIS.;31/12/2007;45.000,0
07-90611-1;0218/2007;SEE - 22.0001 - SECRETARIA DE ESTADO DA EDUCAÇÃO;CONSELHO ESCOLAR IRMÃ J. SAMPAIO/CAMPINA GRANDE;;22/6/2007;EXECUÇÃO DE AÇÕES DE MANUTENÇÃO DAS ATIVIDADES ESCOLARES VISANDO  A MELHORIA DA QUALIDADE DO ENSINO OFERECIDO AOS ALUNOS DO ENSINO MÉDIO.;30/3/2008;2.724,0
07-90594-7;0232/2007;SEE - 22.0001 - SECRETARIA DE ESTADO DA EDUCAÇÃO;CONSELHO ESCOLAR DA EEEFM NENZINHA CUNHA LIMA - CAMPINA GRANDE/PB.;;22/6/2007;EXECUÇÃO DE AÇÕES DE MANUTENÇÃO DAS ATIVIDADES ESCOLARES VISANDO  A MELHORIA DA QUALIDADE DO ENSINO OFERECIDO AOS ALUNOS DO ENSINO MÉDIO.;30/3/2008;7.068,0
07-90591-2;0235/2007;SEE - 22.0001 - SECRETARIA DE ESTADO DA EDUCAÇÃO;CONSELHO ESCOLAR DA ESCOLA ESTADUAL DE ENSINO FUNDAMENTAL E MÉDIO SEVERINO CABRAL - CAMPINA GRANDE/P;;22/6/2007;EXECUÇÃO DE AÇÕES DE MANUTENÇÃO DAS ATIVIDADES ESCOLARES VISANDO  A MELHORIA DA QUALIDADE DO ENSINO OFERECIDO AOS ALUNOS DO ENSINO MÉDIO.;30/3/2008;8.400,0
07-90588-2;0231/2007;SEE - 22.0001 - SECRETARIA DE ESTADO DA EDUCAÇÃO;CONSELHO ESCOLAR DA EEEFM JOSÉ MIGUEL LEÃO - CAMPINA GRANBDE/PB.;;22/6/2007;EXECUÇÃO DE AÇÕES DE MANUTENÇÃO DAS ATIVIDADES ESCOLARES VISANDO  A MELHORIA DA QUALIDADE DO ENSINO OFERECIDO AOS ALUNOS DO ENSINO MÉDIO.;30/3/2008;5.904,0
07-90571-8;0219/2007;SEE - 22.0001 - SECRETARIA DE ESTADO DA EDUCAÇÃO;CONSELHO ESCOLAR DA EEEFM MAJOR VENZIANO VITAL DO RÊGO - CAMPINA GRANDE/PB.;;;EXECUÇÃO DE AÇÕES DE MANUTENÇÃO DAS ATIVIDADES ESCOLARES VISANDO  A MELHORIA DA QUALIDADE DO ENSINO OFERECIDO AOS ALUNOS DO ENSINO MÉDIO.;30/3/2008;960,0
07-90549-1;0233/2007;SEE - 22.0001 - SECRETARIA DE ESTADO DA EDUCAÇÃO;CONSELHO ESCOLAR DA EEEFM PROFESSOR ANESIO LEÃO - CAMPINA GRANDE/PB.;;20/6/2007;EXECUÇÃO DE AÇÕES DE MANUTENÇÃO DAS ATIVIDADES ESCOLARES VISANDO  A MELHORIA DA QUALIDADE DO ENSINO OFERECIDO AOS ALUNOS DO ENSINO MÉDIO.;30/3/2008;5.952,0
07-90475-4;0421/2007;SEE - 22.0001 - SECRETARIA DE ESTADO DA EDUCAÇÃO;CONSELHO ESCOLAR RUBENS DUTRA SEGUNDO /CAMPINA GRANDE;;30/5/2007;CUSTEAR O TRANSPORTE DE ALUNOS DA REDE ESTADUAL DE ENSINO RESIDENTE EM ÁREAS RURAIS.;30/3/2008;75.000,0
07-90470-3;0422/2007;SEE - 22.0001 - SECRETARIA DE ESTADO DA EDUCAÇÃO;CONSELHO ESCOLAR WALNIZA BORBOREMA CUNHA LIMA - CAMPINA GRANDE/PB.;;30/5/2007;CUSTEAR O TRANSPORTE DE ALUNOS DA REDE ESTADUAL DE ENSINO RESIDENTE EM ÁREAS RURAIS.;31/12/2007;50.000,0
07-90447-9;0237/2007;SEE - 22.0001 - SECRETARIA DE ESTADO DA EDUCAÇÃO;CONSELHO ESCOLAR DA EEEFM DR HORTENCIO S. RIBEIRO - CAMPINA GRANDE/PB.;;30/5/2007;EXECUÇÃO DE AÇÕES DE MANUTENÇÃO DAS ATIVIDADES ESCOLARES,VISANDO Á MELHORIA DA QUALIDADE DO ENSINO OFERECIDO AOS ALUNOS DO ENSINO MÉDIO.;30/3/2008;10.140,0
07-90446-1;0222/2007;SEE - 22.0001 - SECRETARIA DE ESTADO DA EDUCAÇÃO;CONSELHO ESCOLAR DA EEEFM ADEMAR VELOSO SILVEIRA - CAMPINA GRANDE/PB.;;30/5/2007;EXECUÇÃO DE AÇÕES DE MANUTENÇÃO DAS ATIVIDADES ESCOLARES,VISANDO Á MELHORIA DA QUALIDADE DO ENSINO OFERECIDO AOS ALUNOS DO ENSINO MÉDIO.;30/3/2008;5.880,0
07-90435-5;0571/2007;SEE - 22.0001 - SECRETARIA DE ESTADO DA EDUCAÇÃO;CONSELHO ESCOLAR DA ESCOLA EST. DE ENS. FUND. E MÉDIO ELPIDIO DE ALMEIDA- CAMPINA GRANDE;;1/6/2007;MELHORIA DO ENSINO MÉDIO NAS ESCOLAS DA REDE ESTADUAL.;30/6/2007;1.500,0
07-90432-1;0003/2007;JUCEP - 21.0501 - JUNTA COMERCIAL DO ESTADO DA PARAÍBA;UNIVERSIDADE ESTADUAL DA PARAÍBA;;;CONCESSÃO DE ESTÁGIO CURRICULAR PARA OS ALUNOS DA UNIVERSIDADE ESTADUAL DA PARAÍBA.;22/5/2009;0,0
07-90400-2;0557/2007;SEE - 22.0001 - SECRETARIA DE ESTADO DA EDUCAÇÃO;ESCOLA TÉCNICA REDENTORISTA-ETER/CAMPINA GRANDE;;25/5/2007;QUALIFICAÇÃO E CAPACITAÇÃO DE MÃO DE OBRA ESPECIALIZADA PARA OS CURSOS TÉCNICOS NAS ÁREAS DE INDUSTRIA,TELECOMUNICAÇÕES,SAÚDE,INFORMÁTICA E TURISMO E HOSPITALIDADE,EM CAMPINA GRANDE/PB.;20/4/2008;780.000,0
07-90384-7;0220/2007;SEE - 22.0001 - SECRETARIA DE ESTADO DA EDUCAÇÃO;CONSELHO ESCOLAR DA EEEF PREFEITO WILLIAM DE SOUSA ARRUDA - CAMPINA GRANDE/PB.;;2/6/2007;EXECUÇÃO DE AÇÕES DE MANTENÇÃO DAS ATIVIDADES ESCOLARES VISANDO Á MELHORIA DA QUALIDADE DO ENSINO OFERECIDO AOS ALUNOS DO ENSINO MÉDIO.;30/3/2008;816,0
07-90347-2;0001/2007;JUCEP - 21.0501 - JUNTA COMERCIAL DO ESTADO DA PARAÍBA;UNIVERSIDADE FEDERAL DE CAMPINA GRANDE - PB.;;18/5/2007;CONCESSÃO DE ESTÁGIO CURRICULAR EM NÚMEROS DE 05 (CINCO) ESTUDANTES.;10/5/2009;15.200,0
07-90212-3;0030/2007;FUNCEP - 20.901 - FUNDO DE COMBATE E ERRADICAÇÃO À POBREZA DO ESTADO;FUNDAÇÃO RUBENS DUTRA SEGUNDO / CAMPINA GRANDE;;26/4/2007;MANUTENÇÃO DO ATENDIMENTO AMBULATÓRIAL ATRAVÉS DE CONSULTA,EXAMES E OUTROS BEM COMO A MANUTENÇÃO DE SERVIÇOS INTERNOS E EXTERNOS.;31/12/2007;60.000,0
07-90211-5;0031/2007;FUNCEP - 20.901 - FUNDO DE COMBATE E ERRADICAÇÃO À POBREZA DO ESTADO;CASA DE ACOLHIDA SÃO PAULO DA CRUZ;;26/4/2007;MANUTENÇÃO DOS PROGRAMAS DE ATENDIMENTO A CLIENTELA ASSISTIDA PELA INSTITUIÇÃO.;30/12/2008;48.000,0
07-90156-9;0418/2007;SEE - 22.0001 - SECRETARIA DE ESTADO DA EDUCAÇÃO;CONSELHO ESCOLAR DA EEEF IRMÃ STEFANIE- CAMPINA GRANDE;;28/4/2007;CUSTEAR O TRANSPORTE DE ALUNOS DA REDE ESTADUAL DE ENSINO RESIDENTES EM ÁREAS RURAIS;31/12/2007;75.000,0
07-90155-1;0420/2007;SEE - 22.0001 - SECRETARIA DE ESTADO DA EDUCAÇÃO;CONSELHO ESCOLAR MARIA AUGUSTA LUCENA BRITO / CAMPINA GRANDE;;26/4/2007;CUSTEAR O TRANSPORTE DE ALUNOS DA REDE ESTADUAL DE ENSINO RESIDENTES EM ÁREAS RURAIS;31/12/2007;75.000,0
07-90141-1;0419/2007;SEE - 22.0001 - SECRETARIA DE ESTADO DA EDUCAÇÃO;CONSELHO ESCOLAR DA EEEF MURILO BRAGA-CAMPINA GRANDE;;26/4/2007;CUSTEAR O TRANSPORTE DE ALUNOS DA REDE ESTADUAL DE ENSINO RESIDENTES EM ÁREAS RURAIS;31/12/2007;75.000,0
07-90122-4;0225/2007;SEE - 22.0001 - SECRETARIA DE ESTADO DA EDUCAÇÃO;CONSELHO ESCOLAR MONSENHOR SALLES - CAMPINA GRANDE/PB.;;26/4/2007;EXECUÇÃO DE AÇÕES DE MANUTENÇÃO DAS ATIVIDADES ESCOLARES,VISANDO A MELHORIA DA QUALIDADE DO ENSINO OFERECIDO AOS ALUNOS DO ENSINO MÉDIO.;30/3/2008;2.592,0
07-90121-6;0227/2007;SEE - 22.0001 - SECRETARIA DE ESTADO DA EDUCAÇÃO;CONSELHO ESCOLAR PROFESSOR RAUL CORDULA - CAMPINA GRANDE/PB.;;26/4/2007;EXECUÇÃO DE AÇÕES DE MANUTENÇÃO DAS ATIVIDADES ESCOLARES,VISANDO A MELHORIA DA QUALIDADE DO ENSINO OFERECIDO AOS ALUNOS DO ENSINO MÉDIO.;30/3/2008;13.020,0
07-90120-8;0228/2007;SEE - 22.0001 - SECRETARIA DE ESTADO DA EDUCAÇÃO;CONSELHO ESCOLAR SÃO SEBASTIÃO - CAMPINA GRANDE/PB.;;26/4/2007;EXECUÇÃO DE AÇÕES DE MANUTENÇÃO DAS ATIVIDADES ESCOLARES,VISANDO A MELHORIA DA QUALIDADE DO ENSINO OFERECIDO AOS ALUNOS DO ENSINO MÉDIO.;30/3/2008;3.564,0
07-90119-4;0226/2007;SEE - 22.0001 - SECRETARIA DE ESTADO DA EDUCAÇÃO;CONSELHO ESCOLAR PROFESSOR ANTONIO OLIVEIRA - CAMPINA GRANDE/PB.;;26/4/2007;EXECUÇÃO DE AÇÕES DE MANUTENÇÃO DAS ATIVIDADES ESCOLARES,VISANDO A MELHORIA DA QUALIDADE DO ENSINO OFERECIDO AOS ALUNOS DO ENSINO MÉDIO.;30/3/2008;4.404,0
07-90115-1;0238/2007;SEE - 22.0001 - SECRETARIA DE ESTADO DA EDUCAÇÃO;CONSELHO ESCOLAR VIRGINIUS DA GAMA E MELO -   CAMPINA GRANDE/PB.;;26/4/2007;EXECUÇÃO DE AÇÕES DE MANUTENÇÃO DAS ATIVIDADES ESCOLARES,VISANDO A MELHORIA DA QUALIDADE DO ENSINO OFERECIDO AOS ALUNOS DO ENSINO MÉDIO.;30/3/2008;5.040,0
07-90110-1;0229/2007;SEE - 22.0001 - SECRETARIA DE ESTADO DA EDUCAÇÃO;CONSELHO ESCOLAR DOM LUIZ G. FERNANDES - CAMPINA GRANDE/PB.;;26/4/2007;EXECUÇÃO DE AÇÕES DE MANUTENÇÃO DAS ATIVIDADES ESCOLARES,VISANDO A MELHORIA DA QUALIDADE DO ENSINO OFERECIDO AOS ALUNOS DO ENSINO MÉDIO.;30/3/2008;4.692,0
07-90103-8;0223/2007;SEE - 22.0001 - SECRETARIA DE ESTADO DA EDUCAÇÃO;CONSELHO ESCOLAR DA ESCOLA EST. FUND. E MÉDIO ASSIS CHATEAUBRIAND- CAMPINA GRANDE;;20/4/2007;EXECUÇÃO DE AÇÕES DE MANUTENÇÃO DAS ATIVIDADES ESCOLARES,VISANDO A MELHORIA DA QUALIDADE DO ENSINO OFERECIDO AOS ALUNOS DO ENSINO MÉDIO.;31/12/2007;7.920,0
07-90096-1;0230/2007;SEE - 22.0001 - SECRETARIA DE ESTADO DA EDUCAÇÃO;CONSELHO ESCOLAR FELIX ARAÚJO - CAMPINA GRANDE/PB.;;26/4/2007;EXECUÇÃO DE AÇÕES DE MANUTENÇÃO DAS ATIVIDADES ESCOLARES,VISANDO A MELHORIA DA QUALIDADE DO ENSINO OFERECIDO AOS ALUNOS DO ENSINO MÉDIO.;30/3/2008;9.516,0
07-90095-3;0234/2007;SEE - 22.0001 - SECRETARIA DE ESTADO DA EDUCAÇÃO;CONSELHO ESCOLAR DA ESCOLA EST. DE ENS. FUND. E MÉDIO ARGEMIRO DE FIGUEIREDO- CAMPINA GRANDE;;26/4/2007;EXECUÇÃO DE AÇÕES DE MANUTENÇÃO DAS ATIVIDADES ESCOLARES,VISANDO A MELHORIA DA QUALIDADE DO ENSINO OFERECIDO AOS ALUNOS DO ENSINO MÉDIO.;30/3/2008;9.624,0
07-90057-1;0018/2007;FUNCEP - 20.901 - FUNDO DE COMBATE E ERRADICAÇÃO À POBREZA DO ESTADO;INSTITUTO DE EDUCAÇÃO E ASSISTÊNCIA AOS CEGOS DO NORDESTE;;28/3/2007;MANUTENÇÃO DA ENTIDADE VISANDO MELJORAR A QUALIDADE DE VIDA DAS PESSOAS COM DEFICIÊNCIA VISUAL.;30/12/2008;96.000,0
07-90050-3;0012/2007;FUNCEP - 20.901 - FUNDO DE COMBATE E ERRADICAÇÃO À POBREZA DO ESTADO;CASA DA CRIANÇA DR. JOÃO MOURA / CAMPINA GRANDE;;20/3/2007;ATENDIMENTO DE CRIANÇAS POBRES DE 0 A 6 ANOS DE IDADE EM REGIME DE APOIO SÓCIO-EDUCATIVO EM MEIO ABERTO COM ATENDIMENTO GRATUITO,NO MUNICÍPIO DE CAMPINA GRANDE/PB.;30/12/2008;240.000,0
07-90033-3;0007/2007;FUNCEP - 20.901 - FUNDO DE COMBATE E ERRADICAÇÃO À POBREZA DO ESTADO;CENTRO DE RECUPERAÇÃO HOMENS DE CRISTO / CAMPINA GRANDE;;3/3/2007;MANUTENÇÃO DE PROGRAMA VISANDO ATENDIMENTO PARA A CLIENTELA ASSISTIDA NA INSTITUIÇÃO.;30/12/2008;192.000,0
07-90032-5;0006/2007;FUNCEP - 20.901 - FUNDO DE COMBATE E ERRADICAÇÃO À POBREZA DO ESTADO;INSTITUTO SÃO VICENTE DE PAULO / CAMPINA GRANDE;;3/3/2007;MANUTENÇÃO DO PROGRAMA VISANDO ATENDIMENTO Á CLIENTELA ASSISTIDA NA INSTITUIÇÃO.;30/12/2008;240.000,0
07-90031-7;0005/2007;FUNCEP - 20.901 - FUNDO DE COMBATE E ERRADICAÇÃO À POBREZA DO ESTADO;CASA DO MENINO / CAMPINA GRANDE;;3/3/2007;MANUTENÇÃO DO PROGRAMA VISANDO ATENDIMENTO Á CLIENTELA ASSISTIDA NA INSTITUIÇÃO.;30/12/2008;192.000,0
07-90026-1;0002/2007;FUNCEP - 20.901 - FUNDO DE COMBATE E ERRADICAÇÃO À POBREZA DO ESTADO;FUNDAÇÃO ASSISTENCIAL DA PARAÍBA  -  FAP;;10/2/2007;AQUISIÇÃO DE MEDICAMENTOS PARA PACIENTES ACOMETIDOS OU PORTADORES  DE CÂNCER.;30/6/2008;360.000,0
07-90024-4;0160/2006;PBTUR 21.0201 - EMPRESA PARAIBANA DE TURISMO S/A;FUNDAÇÃO CULTURAL MUSEU ÉTNICO DO NORDESTE/ CAMPINA GRANDE;;14/2/2007;APOIAR O PROJETO VIII PRESÉPIO VIVO DO NATAL,EVENTO ARTISTICO E CULTURAL INSPIRADO NA HISTÓRIA DO NASCIMENTO DE JESUS CRISTO A SER REALIZADO NO MUNICÍPIO DE CAMPINA GRANDE/PB. NO PERÍODO DE 19 À 31 DE DEZEMBRO DE 2006.;31/3/2007;49.300,0
06-91285-1;0002/2006;JUCEP - 21.0501 - JUNTA COMERCIAL DO ESTADO DA PARAÍBA;UNESC- UNIÃO DE ENSINO SUPERIOR- CAMPINA GRANDE;;9/1/2007;CONCESSÃO DE ESTÁGIOS CURRICULARES EM NÚMERO DE 05 (CINCO) VAGAS PARA ESTUDANTES DA UNESC.;30/10/2010;8.400,0
06-91246-0;0155/2006;PBTUR 21.0201 - EMPRESA PARAIBANA DE TURISMO S/A;INSTITUTO CAMPINENSE DE TURISMO E EVENTOS PARAHYBA CONVENTIO & VISITORS BUREAU - CAMPINA GRANDE;;18/11/2006;VISA APOIAR AS AÇÕES DE PROMOÇÃO E DIVULGAÇÃO DO DESTINO PARAIBA E CAPTAÇÃO DE INVESTIMENTOS NO MERCADO EUROPEU,NO PERÍODO DE 22 A 26 DE NOVEMBRO DE 2006.;30/12/2006;202.567,0
06-91171-4;0272/2006;SEE - 22.0001 - SECRETARIA DE ESTADO DA EDUCAÇÃO;CONSELHO ESCOLAR DA ESCOLA EST. FUND. E MÉDIO ASSIS CHATEAUBRIAND- CAMPINA GRANDE;;16/9/2006;CONSTITUI UMA COOPERAÇÃO MÚTUA ENTRE O ESTADO E CONSELHOS ESCOLARES,VISANDO A MELHORIA DO ENSINO NAS ESCOLAS DE REDE ESTADUAL,INCENTIVO AS PRÁTICAS PEDAGÓGICAS.;17/11/2006;1.500,0
06-91166-8;0273/2006;SEE - 22.0001 - SECRETARIA DE ESTADO DA EDUCAÇÃO;CONSELHO ESCOLAR DA ESCOLA EST. DE ENS. FUND. E MÉDIO ARGEMIRO DE FIGUEIREDO- CAMPINA GRANDE;;15/9/2006;CONSTITUI UMA COOPERAÇÃO MÚTUA ENTRE O ESTADO E CONSELHOS ESCOLARES,VISANDO A MELHORIA DO ENSINO NAS ESCOLAS DE REDE ESTADUAL,INCENTIVO AS PRÁTICAS PEDAGÓGICAS.;17/11/2006;1.500,0
06-91162-5;0274/2006;SEE - 22.0001 - SECRETARIA DE ESTADO DA EDUCAÇÃO;CONSELHO ESCOLAR DA ESCOLA EST. DE ENS. FUND. E MÉDIO ELPIDIO DE ALMEIDA- CAMPINA GRANDE;;16/9/2006;CONSTITUI UMA COOPERAÇÃO MÚTUA ENTRE O ESTADO E CONSELHOS ESCOLARES,VISANDO A MELHORIA DO ENSINO NAS ESCOLAS DE REDE ESTADUAL,INCENTIVO AS PRÁTICAS PEDAGÓGICAS.;17/11/2006;1.500,0
06-91156-1;0271/2006;SEE - 22.0001 - SECRETARIA DE ESTADO DA EDUCAÇÃO;CONSELHO ESCOLAR DA ESCOLA EEEFM ÁLVARO GAUDÊNCIO DE QUEIROZ- CAMPINA GRANDE;;16/9/2006;CONSTITUI UMA COOPERAÇÃO MÚTUA ENTRE O ESTADO E CONSELHOS ESCOLARES,VISANDO A MELHORIA DO ENSINO NAS ESCOLAS DE REDE ESTADUAL,INCENTIVO AS PRÁTICAS PEDAGÓGICAS.;17/11/2006;1.500,0
06-91133-1;0007/2006;FUNESC - 33.201 - FUNDAÇÃO ESPAÇO CULTURAL DA PARAÍBA;INSTITUTO DE ARTE,CULTURAL E CIDADANIA / CAMPINA GRANDE;;28/8/2006;APOIO AO PROJETO XXXI FESTIVAL DE INVERNO DE CAMPINA GRANDE-PB;31/7/2006;200.000,0
06-91113-1;000000000000;FUNESC - 33.201 - FUNDAÇÃO ESPAÇO CULTURAL DA PARAÍBA;INSTITUTO DE ARTE,CULTURAL E CIDADANIA / CAMPINA GRANDE;;;APOIO AO PROJETO XXXI FESTIVAL DE INVERNO DE CAMPINA GRANDE;31/7/2006;200.000,0
06-91107-2;0055/2006;FUNCEP - 20.901 - FUNDO DE COMBATE E ERRADICAÇÃO À POBREZA DO ESTADO;INSTITUTO SÃO VICENTE DE PAULO / CAMPINA GRANDE;;2/8/2006;CONSTITUI TRANSFERIR RECURSOS FINANCEIROS PARA A MANUTENÇÃO DOS PROGRAMAS VISANDO A CLIENTELA,ATENDIDA NA INSTITUIÇÃO.;31/12/2006;32.000,0
06-91086-6;0145/2006;PBTUR 21.0201 - EMPRESA PARAIBANA DE TURISMO S/A;VISÃO NACIONAL CONSCIÊCIA CRISTÃ/CAMPINA GRANDE;;13/7/2006;CONSTITUI TRANSFERIR RECURSOS FINANCEIROS DESTINADOS A APOIAR O ARRAIAL DE DEUS,QUE ACONTECE DURANTE OS MESES DE JUNHO E JULHO DE 2006.;30/8/2006;59.100,0
06-91077-7;0026/2006;SEDH - 27.0001 - SECRETARIA DE ESTADO DO DESENVOLVIMENTO HUMANO;PREFEITURA MUNICIPAL DE CAMPINA GRANDE;;19/7/2006;CONSTITUI TRANSFERIR RECURSOS FINANCEIROS VISANDO A REVISÃO DE PRESTAÇÃO SOCIAL DOS BENEFÍCIOS DE PRESTAÇÃO CONTINUADA.;31/12/2007;28.100,0
06-91070-0;0150/2006;SEDH - 27.0001 - SECRETARIA DE ESTADO DO DESENVOLVIMENTO HUMANO;ASSOC. RURAL COMUNITÁRIA DO SÍTIO CAPIM GRNADE-CAMPINA GRANDE;;1/7/2006;CONSTITUI O PROJETO ÁGUA PARA TODOS.;30/10/2007;96.030,0
06-91055-6;S/N - 2006;SEE - 22.0001 - SECRETARIA DE ESTADO DA EDUCAÇÃO;UNIVERSIDADE ESTADUAL DA PARAÍBA;;3/8/2006;CONSTITUI TRANSFERIR RECURSOS FINANCEIROS PRPORCIONANDO AOS ALUNOS CARENTES E REGULAMENTE MATRICULADOS NOS CURSOS DE GRADUAÇÃO DO CAMPUS.;28/5/2007;28.000,0
06-91048-3;0021/2006;SES - 25.0001 - SECRETARIA DE ESTADO DA SAÚDE;REDE NACIONAL DE PESSOAS VIVENDO COM HIV/AIDS - NUCLEO CAMPINA GRANDE.;;1/7/2006;CONSTITUI UMA COOPERAÇÃO TÉCNICA FINANCEIRA O PROJETO ACREDITANDO NO FUTURO DOS JOVENS PORTADORES DE HIV/AIDS.;28/12/2006;30.000,0
06-91025-4;0006/2006;FUNESC - 33.201 - FUNDAÇÃO ESPAÇO CULTURAL DA PARAÍBA;ASSOC. DOS MÚSICOS DA ORQUESTRA SANFÔNICA RONALDO CUNHA LIMA/ CAMPINA GRANDE;;30/6/2006;MANUTENÇÃO DOS INSTRUMENTOS DA ORQUESTRA SINFÔNICA RONALDO CUNHA LIMA.;31/12/2006;175.000,0
06-91018-1;0359/2006;SEE - 22.0001 - SECRETARIA DE ESTADO DA EDUCAÇÃO;GRUPO CUTLTURAL ARGILAS AMIGOS DA ARTE E DO MEIO AMBIENTE / CAMPINA GRANDE;;2/8/2006;CONSTITUI ESTABELECER UM REGIME DE MÚTUA COOPERAÇÃO ENTRE OS CONVENENTES,COM EXPANSÃO E MELHORIA DO ENSINO.;28/8/2007;84.640,0
06-90977-9;0010/2006;SES - 25.0001 - SECRETARIA DE ESTADO DA SAÚDE;GRUPO DE APOIO A VIDA - GAV - CAMPINA GRANDE/PB.;;29/6/2006;HUMANIZAÇÃO E DIREITO DAS PESSIOAS VIVENDO COM HIV/AIDS NESTE ESTADO.;28/12/2006;21.738,90
06-90976-1;0011/2006;SES - 25.0001 - SECRETARIA DE ESTADO DA SAÚDE;ONG-CENTRO INFORMATIVO DE PREV. MOBIL,E ACONSELHAMENTO AOS PROFISSIONAIS DO SEXO-CAMPINA GRANDE;;29/6/2006;REALIZAÇÃO DO PROJETO PROFISSIONAIS DO SEXO,SAÚDE E EDUACAÇÃO PREVENTIVA NESTE ESTADO.;28/12/2006;14.492,0
06-90975-2;0012/2006;SES - 25.0001 - SECRETARIA DE ESTADO DA SAÚDE;REDE NACIONAL DE PESSOAS VIVENDO COM HIV/AIDS - NUCLEO CAMPINA GRANDE.;;29/6/2006;REALIZAÇÃO DE PROJETO RESGATANDO A DIGNIDADE PELA PROFISSIONALIZAÇÃO NESTE ESTADO.;28/2/2007;21.738,0
06-90966-3;0369/2006;SEE - 22.0001 - SECRETARIA DE ESTADO DA EDUCAÇÃO;ESCOLA CENECISTA DE SÃO JOSÉ DA MATA/CAMPINA GRANDE;;29/6/2006;EXPANSÃO E MELHORIA DO ENSINO COM VISTA Á CONCESSÃO DE SUBVENÇÃO A ESCOLA CENECISTA SÃO JOSÉ DA MATA.;31/12/2006;24.000,0
06-90960-4;0275/2006;SEE - 22.0001 - SECRETARIA DE ESTADO DA EDUCAÇÃO;CONSELHO ESCOLAR DA ESCOLA ESTADUAL DE ENSINO FUNDAMENTAL E MÉDIO SEVERINO CABRAL - CAMPINA GRANDE/P;;19/12/2006;MELHORIA DO ENSINO MEDIO NAS ESCOLAS DA REDE ESTADUAL NO MUNICÍPIO DE CAMPINA GRANDE/PB.;8/7/2006;1.500,0
06-90945-1;0370/2006;SEE - 22.0001 - SECRETARIA DE ESTADO DA EDUCAÇÃO;ESCOLA CENECISTA ANTONIO FAUSTINO DA SILVA AMORIM - DISTRITO DE GALANTE - CAMPINA GRANDE/PB.;;29/6/2006;EXPANSÃO E MELHORIA DO ENSINO COM VISTA A CONCESSÃO DE SUBVENÇÃO A ESCOLA CENECISTA ANTONIO FAUSTINO DA SILVA AMORIM NO DISTRITO DE GALANTE.;31/12/2006;40.000,0
06-90923-0;0363/2006;SEE - 22.0001 - SECRETARIA DE ESTADO DA EDUCAÇÃO;CONSELHO ESCOLAR WALNIZA BORBOREMA CUNHA LIMA - CAMPINA GRANDE/PB.;;29/6/2006;CUSTEAR O TRANSPORTE ESCOLAR DE ALUNOS DA REDE ESTADUAL RESIDENTE EM ÁREAS RUARAIS.;1/4/2007;50.000,0
06-90915-9;0009/2006;SES - 25.0001 - SECRETARIA DE ESTADO DA SAÚDE;FUNDAÇÃO RUBENS DUTRA SEGUNDO / CAMPINA GRANDE;;29/6/2006;EXECUÇÃO DOS SERVIÇOS MÉDICOS HOSPITALARES NA PREVENÇÃO DIAGNÓSTICO E TRATAMENTO DE ONCOLOGIA INFANTIL E OUTROS N O HOSPITAL MEMORIAL RUBENS DUTRA SEGUNDO EM CAMPINA GRANDE/PB.;21/8/2008;300.000,0
06-90905-1;0019/2006;SETDE - 21.0001 - SECRETARIA DE ESTADO DO TURISMO E DESENVOLVIMENTO ECONÔMICO;CÂMERA DIRIGENTES LOJISTAS - CDL / CAMPINA GRANDE;;28/6/2006;PARTICIPAÇÃO DA SETDE NA CAMPANHA LIQUIDA CAMPINA 2006,QUE REALIZAR-SE-A NO PERÍODO DE 21 DE JULHO A 29 DE JULHO DE 2006 NO MUNICÍPIO DE CAMPINA GRANDE/PB.;31/12/2006;120.000,0
06-90806-3;0045/2006;PBTUR 21.0201 - EMPRESA PARAIBANA DE TURISMO S/A;ASSOC. DAS QUADRILHAS TRADICIONAIS MATUTAS DA PARAÍBA;;22/6/2006;CONSTITUI TRANSFERIR RECURSOS FINANCEIROS VISANDO APOIAR AS APRESENTAÇÃOES DAS QUADRILHAS JUNINAS NA CIDADE DE CAMPINA  GRANDE,NO PERÍODO DE 09 DE JUNHO A 09 DE JULHO DE 2006.;31/7/2006;99.100,0
06-90803-9;0046/2006;PBTUR 21.0201 - EMPRESA PARAIBANA DE TURISMO S/A;PREFEITURA MUNICIPAL DE CAMPINA GRANDE;;22/6/2006;CONSTITUI TRANSFERIR RECURSOS FINANCEIROS VISANDO APOIAR AS COMEMORAÇÕES DO MAIOR SÃO JOÃO DO MUNDO,NO PERÍODO DE 09 DE JUNHO A 09 DE JULHO DE 2006.;15/8/2006;324.500,0
06-90796-2;0056/2006;PBTUR 21.0201 - EMPRESA PARAIBANA DE TURISMO S/A;CENTRO DESENV.ATIV.FÍSICA SAÚDE/CIDADANIA/CAMPINA GRANDE;;20/6/2006;REPASSAR RECURSOS FINANCEIROS PARA O EVENTO 7ª CORRIDA DOS NAMORADOS E 16ª CORRIDA DO JEGUE.;31/7/2006;5.450,0
06-90787-3;0321/2006;SEE - 22.0001 - SECRETARIA DE ESTADO DA EDUCAÇÃO;SOCIEDADE MISSIONÁRIA ESCOLAR NOSSA SENHORA DOS PODERES - CAMPINA GRANDE/PB.;;22/6/2006;IMPLANTAÇÃO E IMPLEMENTAÇÃO DE CURSO PRÉ-VESTIBULAR  PARA ALUNOS DA REDE PUBLICA ESTADUAL DE ENSINO.;30/5/2007;40.000,0
06-90775-0;0044/2006;PBTUR 21.0201 - EMPRESA PARAIBANA DE TURISMO S/A;FUNDAÇÃO CULTURAL MUSEU ÉTNICO DO NORDESTE/ CAMPINA GRANDE;;15/6/2006;APOIAR O PROJETO SÍTIO SÃO JOÃO 2006,QUE É UMA MONTAGEM CENOGRÁFICA EM TAMANHO NATURAL DE VILAREJO RURAL DO SÉCULO XIX QUE FICARÁ EM EXPOSIÇÃO NA CIDADE DE CAMPIA GRANDE/PB. DURANTE O PERÍODO DE 03 DE JUNHO Á 30 DE JULHO DE 2006.;1/8/2006;79.100,0
06-90684-2;0003/2006;EMEPA - 32.202 - EMPRESA ESTADUAL DE PESQUISA AGROPECUÁRIA DA PARAÍBA;UNIVERSIDADE ESTADUAL DA PARAÍBA;;10/6/2006;CONSTITUI CONCESSÃO DE ESTÁGIOS CURRICULARES A ESTUDANTES DO CURSO SUPERIOR OU NÍVEL MÉDIO,VISANDO COMPLEMENTAR O APRENDIZADO.;22/5/2008;0,0
06-90572-2;0043/2006;PCOOPERAR - 28.101 - PROJETO COOPERAR DO ESTADO DA PARAIBA;GRUPO DE VOLUNTÁRIOS DE CAMPINA GRANDE / CAMPINA GRANDE;;3/6/2006;SUBPROJETO DE APOIO A CRECHE COMUNITÁRIA NA COMUNIDADE DE TAMBOR E OUTRAS NO MUNICÍPIO DE CAMPINA GRANDE/PB.;15/11/2006;81.058,82
06-90523-4;0105/2006;SEE - 22.0001 - SECRETARIA DE ESTADO DA EDUCAÇÃO;CONSELHO ESCOLAR MARIA AUGUSTA LUCENA BRITO / CAMPINA GRANDE;;11/5/2006;CUSTEAR O TRANSPORTE ESCOLAR DOS ALUNOS DA REDE ESTADUAL RESIDENTE EM ÁREAS RURAIS.;1/4/2007;75.000,0
06-90518-8;0106/2006;SEE - 22.0001 - SECRETARIA DE ESTADO DA EDUCAÇÃO;CONSELHO ESCOLAR DA EEEF IRMÃ STEFANIE- CAMPINA GRANDE;;11/5/2006;CUSTEAR O TRANSPORTE ESCOLAR DOS ALUNOS DA REDE ESTADUAL RESIDENTE EM ÁREAS RURAIS.;1/4/2007;75.000,0
06-90514-5;0033/2006;PBTUR 21.0201 - EMPRESA PARAIBANA DE TURISMO S/A;PREFEITURA MUNICIPAL DE CAMPINA GRANDE;;13/5/2006;APOIAR O PROJETO MICARANDE 2006,CARNAVAL FORA DE ÉPOCA DE CAMPINA GRANDE/PB. QUE SERÁ REALIZADO NO PERÍODO DE 22/04 Á 01/05/2006.;30/6/2006;148.700,0
06-90502-1;0104/2006;SEE - 22.0001 - SECRETARIA DE ESTADO DA EDUCAÇÃO;CONSELHO ESCOLAR RUBENS DUTRA SEGUNDO /CAMPINA GRANDE;;12/5/2006;CONSTITUI REGIME DE MÚTUA COOPERAÇÃO COM VISTAS A CUSTEAR O TRANSPORTE ESCOLAR DOS ALUNOS RESIDENTES EM ÁREAS RURAIS E URBANAS.;1/4/2007;75.000,0
06-90492-1;0107/2006;SEE - 22.0001 - SECRETARIA DE ESTADO DA EDUCAÇÃO;CONSELHO ESCOLAR DA EEEF MURILO BRAGA-CAMPINA GRANDE;;12/5/2006;CONSTITUI REGIME DE MÚTUA COOPERAÇÃO COM VISTAS A CUSTEAR O TRANSPORTE ESCOLAR DOS ALUNOS RESIDENTES EM ÁREAS RURAIS E URBANAS.;1/4/2007;75.000,0
06-90460-2;0032/2006;PBTUR 21.0201 - EMPRESA PARAIBANA DE TURISMO S/A;INSTITUTO DE ARTE,CULTURAL E CIDADANIA / CAMPINA GRANDE;;6/5/2006;CONSTITUI TRANSFERIR RECURSOS FINANCEIROS VISANDO APOIAR A APRESENTAÇÃO DO BLOCO DA SAUDADE DURANTE A MICARANDE 2006.;30/6/2006;9.450,0
06-90445-9;0031/2006;PBTUR 21.0201 - EMPRESA PARAIBANA DE TURISMO S/A;ASSOC. CARNAVALESCA BLOCO ZÉ PEREIRA - CAMPINA GRANDE/PB.;;5/5/2006;APOIAR O BLOCO ZÉ PEREIRA DURANTE A MIOCARANDE 2006 CARNAVAL FORA DE ÉPOCA NA CIDADE DE CAMPINA GRANDE/PB. NO PERÍODO DE 29/04 Á 01/05/2006.;30/6/2006;9.450,0
06-90436-0;0030/2006;PBTUR 21.0201 - EMPRESA PARAIBANA DE TURISMO S/A;CENTRO DESENV.ATIV.FÍSICA SAÚDE/CIDADANIA/CAMPINA GRANDE;;5/5/2006;APOIAR O EVENTO AGITA MUNDO NO MUNICÍPIO DE CAMPINA GRANDE/PB.;30/6/2006;9.450,0
06-90416-5;0024/2006;FUNCEP - 20.901 - FUNDO DE COMBATE E ERRADICAÇÃO À POBREZA DO ESTADO;CASA DE ACOLHIDA SÃO PAULO DA CRUZ;;21/4/2006;CONSTITUI TRANFERIR RECURSOS FINANCEIROS DESTINADOS A MANUTENÇÃO DOS PROGRAMAS DE ATENDIMENTO A CLIENTELA ATENDIDA NA INSTITUIÇÃO.;31/12/2006;36.000,0
06-90381-9;0027/2006;FUNCEP - 20.901 - FUNDO DE COMBATE E ERRADICAÇÃO À POBREZA DO ESTADO;FUNDAÇÃO RUBENS DUTRA SEGUNDO / CAMPINA GRANDE;;29/4/2006;CONSTITUI TRANFERIR RECURSOS FINANCEIROS DESTINADOS A MANUTENÇÃO DE ATENDIMENTO AMBULATORIAL,ATRAVÉS DE CONSULTAS,EXAMES E OUTROS.;31/12/2006;180.000,0
06-90207-3;0001/2006;FUNESC - 33.201 - FUNDAÇÃO ESPAÇO CULTURAL DA PARAÍBA;ASSOC. REPENTISTAS E POETAS NORDESTINO/CAMPINA GRANDE;;7/4/2006;REFERENTE AO XXIX CONGRESSO NACIONAL DE VIOLEIROS,QUE OCORRERÁ NOS DIAS 24 E 25 DE MARÇO DE 2006 NA CIDADE DE CAMPINA GRANDE/PB.;25/4/2006;30.000,0
06-90131-0;0003/2006;SETDE - 21.0001 - SECRETARIA DE ESTADO DO TURISMO E DESENVOLVIMENTO ECONÔMICO;INSTITUTO CAMPINENSE DE TURISMO E EVENTOS PARAHYBA CONVENTIO & VISITORS BUREAU - CAMPINA GRANDE;;14/3/2006;PARTICIPAÇÃO DO GOVERNO DO ESTADO NOS EVENTOS DENOMINADO LIVE & INVEST IN BRAZIL 2006.;30/4/2006;90.000,0
06-90092-5;0001/2006;EMATER - 32.201 - EMPRESA DE ASSISTÊNCIA TÉCNICA E EXTENSÃO RURAL;FUNDAÇÃO DE APOIO À PESQUISA DO ESTADO DA PARAÍBA ;;25/2/2006;CONSTITUI IMPLEMENTAR MELHORIAS NA INFRA-ESTRUTURA DOS SERVIÇOS A SUSTENTABILIDADE ECONÔMICA,POLÍTICA,SOCIAL E AMBIENTAL.;5/5/2008;1.086.000,0
06-90058-5;0005/2006;SEDH - 27.0001 - SECRETARIA DE ESTADO DO DESENVOLVIMENTO HUMANO;*EXC 2º BATALHÃO POLÍCIA MILITAR;;;EXECUÇÃO DOS PROGRAMAS ASSISTENCIAIS DE ATENDIMENTO Á CRIANÇA DE ACORDO COM O PLANO DE TRABALHO;31/12/2008;15.930,72
06-90049-6;0010/2006;SEDH - 27.0001 - SECRETARIA DE ESTADO DO DESENVOLVIMENTO HUMANO;UNIVERSIDADE ESTADUAL DA PARAÍBA;;10/3/2006;CONSTITUI A EXECUSÃO DOS PROGRAMAS ASSISTENCIAIS DE NATUREZA CONTINUADA,DE ATENDIMENTO À CRIANÇA,DE ACORDO COM O PLANO DE TRABALHO.;31/12/2007;40.848,0
06-90037-2;0005/2006;PBTUR 21.0201 - EMPRESA PARAIBANA DE TURISMO S/A;ORGANIZAÇÃO NOVA CONSCIÊNCIA;;5/5/2006;APOIAR O 15º ENCONTRO DA NOVA CONSCIÊNCIA EM CAMPINA GRANDE/PB. NO PERÍODO DE 24 A 28/02/2006.;30/4/2006;99.100,0
06-90031-3;0010/2006;FUNCEP - 20.901 - FUNDO DE COMBATE E ERRADICAÇÃO À POBREZA DO ESTADO;FUNDAÇÃO ASSISTENCIAL DA PARAÍBA  -  FAP;;11/2/2006;CONSTITUI TRANSFERIR RECURSOS FINANCEIROS DESTINADOS À AQUISIÇÃO DE MEDICAMENTOS QUIMIOTERÁPICOS PARA PACIENTES PORTADORES DE CÂNCER.;31/12/2007;360.000,0
05-90917-1;0021/2005;SES - 25.0001 - SECRETARIA DE ESTADO DA SAÚDE;GRUPO DE APOIO A VIDA - GAV - CAMPINA GRANDE/PB.;;29/12/2005;REALIZAÇÃO DO PROJETO CIDADANIA CONQUISTA DE DIREITOS E HUMANIZAÇÃO EM HIV/AIDS.;21/12/2006;20.000,0
05-90916-3;0020/2005;SES - 25.0001 - SECRETARIA DE ESTADO DA SAÚDE;REDE NACIONAL PESQUISA AO VIRUS HIV - AIDS / CAMPINA GRANDE;;29/12/2005;REALIZAÇÃO DO PROJETO ACREDITANDO NO FUTURO DOS JOVENS PORTARES DE HIV/AIDS.;21/12/2006;20.000,0
05-90910-4;0014/2005;SES - 25.0001 - SECRETARIA DE ESTADO DA SAÚDE;ONG-CENTRO INFORMATIVO DE PREV. MOBIL,E ACONSELHAMENTO AOS PROFISSIONAIS DO SEXO-CAMPINA GRANDE;;29/12/2005;TRANSFERIR RECURSOS PARA A REALIZAÇÃO DO PROJETO PROFISSIONAIS DO SEXO- PRÁTICAS SEXUIAS SEGURAS;21/12/2006;14.086,0
05-90879-5;0263/2005;SEE - 22.0001 - SECRETARIA DE ESTADO DA EDUCAÇÃO;ESCOLA CINETISTA SÃO JOSÉ DA MATA;;17/12/2005;EXPANSÃO E MELHORIA DO ENSINO NA ESCOLA;31/3/2006;40.000,0
05-90872-8;0006/2005;FUNCEP - 20.901 - FUNDO DE COMBATE E ERRADICAÇÃO À POBREZA DO ESTADO;INSTITUTO SÃO VICENTE DE PAULO / CAMPINA GRANDE;;16/12/2005;CONSTITUI A MANUTENÇÃO DOS PROGRAMAS VISANDO ATENDIMENTO DA CLIENTELA NA INSTITUIÇÃO;31/12/2006;32.000,0
05-90869-8;0012/2005;FUNCEP - 20.901 - FUNDO DE COMBATE E ERRADICAÇÃO À POBREZA DO ESTADO;INSTITUTO DE EDUCAÇÃO E ASSISTÊNCIA AOS CEGOS DO NORDESTE;;16/12/2005;CONSTITUI A MANUTENÇÃO DOS PROGRAMAS VISANDO ATENDIMENTO DA CLIENTELA NA INSTITUIÇÃO;31/12/2006;32.000,0
05-90867-1;0025/2005;FUNCEP - 20.901 - FUNDO DE COMBATE E ERRADICAÇÃO À POBREZA DO ESTADO;GRUPO DE VOLUNTÁRIOS DE CAMPINA GRANDE / CAMPINA GRANDE;;16/12/2005;CONSTITUI A MANUTENÇÃO DOS PROGRAMAS VISANDO ATENDIMENTO DA CLIENTELA NA INSTITUIÇÃO;31/12/2006;16.000,0
05-90866-3;0008/2005;FUNCEP - 20.901 - FUNDO DE COMBATE E ERRADICAÇÃO À POBREZA DO ESTADO;CENTRO DE RECUPERAÇÃO HOMENS DE CRISTO / CAMPINA GRANDE;;16/12/2005;CONSTITUI A MANUTENÇÃO DOS PROGRAMAS VISANDO ATENDIMENTO DA CLIENTELA NA INSTITUIÇÃO;31/12/2006;40.000,0
05-90863-9;0011/2005;FUNCEP - 20.901 - FUNDO DE COMBATE E ERRADICAÇÃO À POBREZA DO ESTADO;ASSOC. VIDA NOVA DOS REMIDOS NO SENHOR;;16/12/2005;CONSTITUI A MANUTENÇÃO DOS PROGRAMAS VISANDO ATENDIMENTO DA CLIENTELA NA INSTITUIÇÃO;31/12/2006;8.000,0
05-90860-4;0007/2005;FUNCEP - 20.901 - FUNDO DE COMBATE E ERRADICAÇÃO À POBREZA DO ESTADO;CASA DO MENINO / CAMPINA GRANDE;;16/12/2005;CONSTITUI A MANUTENÇÃO DOS PROGRAMAS VISANDO ATENDIMENTO DA CLIENTELA NA INSTITUIÇÃO;31/12/2006;64.000,0
05-90855-8;0010/2005;FUNCEP - 20.901 - FUNDO DE COMBATE E ERRADICAÇÃO À POBREZA DO ESTADO;CASA DA CRIANÇA DR. JOÃO MOURA / CAMPINA GRANDE;;16/12/2005;CONSTITUI A MANUTENÇÃO DOS PROGRAMAS VISANDO ATENDIMENTO DA CLIENTELA NA INSTITUIÇÃO;31/12/2006;64.000,0
05-90840-0;0145/2005;PCOOPERAR - 28.101 - PROJETO COOPERAR DO ESTADO DA PARAIBA;ASSOC. RURAL COMUNITÁRIA DO SÍTIO TAMBOR- CAMPINA GRANDE;;15/12/2005;CONSTITUI UM SUBPROJETO DE CRECHE COMUNITÁRIA- CONSTRUÇÃO E INSTALAÇÃO NA COMUNIDADE SÍTIO TAMBOR A BANEFICIAR 60 FAMÍLIAS;7/8/2006;216.152,24
05-90833-7;0033/2005;PBTUR 21.0201 - EMPRESA PARAIBANA DE TURISMO S/A;FUNDAÇÃO CULTURAL MUSEU ÉTNICO DO NORDESTE/ CAMPINA GRANDE;;15/12/2005;APOIAR E PROMOVER O PROJETO VII PRESÉPIO VIVO DO NATAL INSPIRADO NA HISTÓRIA DO NASCIMENTO DE JESUS CRISTO NO PERÍODO DE 19 A 25 DE DEZEMBRO DE 2005.;31/1/2006;89.100,0
05-90812-4;0010/2005;SES - 25.0001 - SECRETARIA DE ESTADO DA SAÚDE;FUNDAÇÃO RUBENS DUTRA SEGUNDO / CAMPINA GRANDE;;13/12/2005;TRANSFERIR RECURSOS FINANCEIROS PARA EXECUÇÃO DOS SERVIÇOS DE MALHORAMENTO HOSPITALAR DO HOSPITAL MEMORIAL RUBENS DUTRA SEGUNDO;25/3/2006;80.000,0
05-90800-1;0007/2005;SES - 25.0001 - SECRETARIA DE ESTADO DA SAÚDE;FUNDAÇÃO RUBENS DUTRA SEGUNDO / CAMPINA GRANDE;;13/12/2005;EXECUÇÃO DOS SERVIÇOS MÉDICOS HOSPITALARES NO HOSPITAL MEMORIAL RUBENS DUTRA SEGUNDO CAMPINA GRANDE/PB.;24/3/2006;40.000,0
05-90789-6;0032/2005;FIC - 33.902 - FUNDO DE INCENTIVO À CULTURA AUGUSTO DOS ANJOS;FUNDAÇÃO ARTISTÍCAO CULTURAL SUELLEN CAROLINI;;26/11/2005;REALIZAÇÃO DE PROJETO CULTURAL NA ÁREA DE PRESERVAÇÃO E RESTAURO.;31/10/2006;37.975,33
05-90787-0;0029/2005;FIC - 33.902 - FUNDO DE INCENTIVO À CULTURA AUGUSTO DOS ANJOS;GRUPO CUTLTURAL ARGILAS AMIGOS DA ARTE E DO MEIO AMBIENTE / CAMPINA GRANDE;;26/11/2005;REALIZAÇÃO DE PROJETO CULTURAL NA ÁREA DE ARTESANATO.;30/11/2006;81.458,37
05-90786-1;0025/2005;FIC - 33.902 - FUNDO DE INCENTIVO À CULTURA AUGUSTO DOS ANJOS;PREFEITURA MUNICIPAL DE CAMPINA GRANDE;;26/11/2005;REALIZAÇÃO DE PROJETO CULTURAL NA ÁREA DE PATRIMÔNIO.;30/11/2006;70.574,62
05-90781-1;0005/2005;SES - 25.0001 - SECRETARIA DE ESTADO DA SAÚDE;REDE NACIONAL DE PESSOAS VIVENDO COM HIV/AIDS - NUCLEO CAMPINA GRANDE.;;25/11/2005;REALIZAÇÃO DO PROJETO II ENCONTRO PARAIBANO DE PESSOAS VIVENDO E CONVIVENDO COM HIV/AIDS.;30/1/2006;44.920,0
05-90765-9;0079/2005;SEDH - 27.0001 - SECRETARIA DE ESTADO DO DESENVOLVIMENTO HUMANO;*EXC 2º BATALHÃO POLÍCIA MILITAR;;10/11/2005;EXECUÇÃO DO PROGRAMA VIDA CRIANÇA DE ATENDIMENTO A CRIANÇA DA CRECHE ISAURA GOMES DE FARIAS,LOCALIZADA NO II BPM EM CAMPINA GRANDE/PB.;31/12/2005;5.310,24
05-90673-3;0018/2005;FUNESC - 33.201 - FUNDAÇÃO ESPAÇO CULTURAL DA PARAÍBA;INSTITUTO DE ARTE,"CULTURAL E CIDADANIA / CAMPINA GRANDE;;20/8/2005;""XXX FESTIVAL DE INVERNO DE CAMPINA GRANDE"";15/3/2006;242.000,0
