REG.CGE;NÚMERO;ÓRGÃO;CONVENENTE;CELEBRAÇÃO;PUBLICAÇÃO;OBJETO;VIGÊNCIA;VALOR TOTAL
12-80230-1;0211/2012;SEE - 22.0001 - SECRETARIA DE ESTADO DA EDUCAÇÃO;CONSELHO ESCOLAR IRMÃ J. SAMPAIO/CAMPINA GRANDE;18/5/2012;24/5/2012;CUSTEAR O TRANSPORTE ESCOLAR DE ALUNOS RESIDENTES EM AREAS RURAIS PARA AS ESCOLAS DA REDE ESTADUAL DE ENSINO DA ZONA URBANA.;28/2/2013;46.200,0
12-80228-0;0005/2012;SEAD - 19.0001 - SECRETARIA DO ESTADO DA ADMINISTRACAO;ASSOCIAÇÃO DOS MILITARES ESTADUAIS DA PARAIBA - AMEP;18/5/2012;24/5/2012;TEM A FINALIDADE DE CONSIGNAR EM FOLHA DE PAGAMENTO DOS SERVIDORES PUBLICOS ESTADUAIS DESCONTOS CONCERNENTES À CONTRIBUIÇÃO ASSOCIATIVA.;18/5/2013;0,0
12-80221-2;0001/2012;AESA - 31.208 - AGÊNCIA EXEC. DE GESTÃO DAS ÁGUAS DO ESTADO DA PARAIBA;UNIVERSIDADE FEDERAL DE CAMPINA GRANDE - PB.;12/3/2012;17/5/2012;COOPERAÇÃO TÉCNICA CIENTIFICA. EDUCACIONAL E,ADMINISTRATIVA.;12/3/2016;0,0
12-80214-0;0008/2012;SEC - 33.101 - SECRETARIA DE ESTADO DA CULTURA;ASSOC. REPENTISTAS E POETAS NORDESTINO/CAMPINA GRANDE;10/5/2012;12/5/2012;APOIO FINANCEIRO AO XXXI FESTIVAL NACIONAL DE VIOLEIROS.;30/6/2012;30.000,0
12-80213-1;0001/2012;FERH - 31.902 - FUNDO ESTADUAL DE RECURSOS HÍDRICOS;UNIVERSIDADE FEDERAL DE CAMPINA GRANDE - PB.;12/3/2012;12/5/2012;CONCESSÃO DE ESTÁGIOS CURRICULARES PARA ALUNOS DESSA INSTITUIÇÃO.;12/3/2016;0,0
12-80083-0;0007/2012;SEC - 33.101 - SECRETARIA DE ESTADO DA CULTURA;ORGANIZAÇÃO NOVA CONSCIÊNCIA;14/2/2012;16/2/2012;APOIO FINANCEIRO AO 21º ENCONTRO DA NOVA CONSCIÊNCIA.;30/4/2012;65.000,0
12-80075-9;0001/2012;PROCON - 09.203 - PROCON/PB - PROTEÇÃO E DEFESA DO CONSUMIDOR DO ESTADO DA PARÍBA;CENTRO DE ENSINO SUPERIOR E DESENVOLVIMENTO LTDA / CAMPINA GRANDE;1/2/2012;16/2/2012;REALIZAÇÃO DE ESTÁGIO NÃO  OBRIGATÓRIO DE ALUNOS REGULARMENTE MATRICULADOS A PARTIR DO 7º PERÍODO DO CURSO DE DIREITO,ENCAMINHADOS PELA FACULDADE DE CIÊNCIAS SOCIAIS APLICADAS - FACISA,A PARTIR DE AVALIAÇÃO TÉCNICA MEDIANTE PROCESSO SELETIVO REGULAR,PARA PREENCHIMENTO DE 10 (DEZ) VAGAS DE ESTÁGIO,COM O FIM DE EXERCER ATIVIDADES JUNTO AO PROCON-PB.;1/2/2014;96.000,0
12-80041-4;0011/2011;SEAP - 24.0001 - SECRETARIA DE ESTADO DE ADMINISTRAÇÃO PENITENCIÁRIA;UNIVERSIDADE ESTADUAL DA PARAÍBA;22/12/2011;26/1/2012;O PRESENTE TERMO DE COOPERAÇÃO TÉCNICA,TEM POR OBJETIVO,A FORMAÇÃO DE TURMAS NAS INSTITUIÇÕES PRISIONAIS DO ESTADO DA PARAÍBA,PARA REALIZAÇÃO DO CURSO DE FORMAÇÃO EM CORTE E COSTURA,COM VISTA AO PROCESSO DE RESSOCIALIZAÇÃO DE REEDUCANDOS DO SISTEMA CARCERÁRIO DA PARAÍBA;22/12/2012;0,0
11-80914-1;0027/2011;FUNCEP - 20.901 - FUNDO DE COMBATE E ERRADICAÇÃO À POBREZA DO ESTADO;ORGANIZAÇÃO PAPEL MARCHE - PAPEL MARCHE / CAMPINA GRANDE;16/12/2011;22/12/2011;AQUISIÇÃO DE EQUIPAMENTOS PARA A INSTITUIÇÃO.;31/1/2012;37.829,0
11-80890-0;0007/2011;FERH - 31.902 - FUNDO ESTADUAL DE RECURSOS HÍDRICOS;UNIVERSIDADE ESTADUAL DA PARAÍBA;10/12/2011;17/12/2011;ESTÁGIO CURRICULAR OBRIGATÓRIO E NÃO OBRIGATÓRIO JUNTO A UEPB.;10/12/2015;0,0
11-80886-1;024S/2011;SES - 25.0001 - SECRETARIA DE ESTADO DA SAÚDE;REDE NACIONAL PESQUISA AO VIRUS HIV - AIDS / CAMPINA GRANDE;7/12/2011;13/12/2011;O PRESENTE CONVÊNIO TEM POR OBJETO DESENVOLVER AÇÕES SOCIAIS PARA MELHORAR A QUALIDADE DE VIDA DE PESSOAS QUE VIVEM E CONVIVEM COM HIV/AIDS NO ESTADO DA PARAÍBA,VISANDO A VOLTA DOS PORTADORES AO CONVÍVIO SOCIAL,COMO FORMA DE COMBATER O PRECONCEITO E A DISCRIMINAÇÃO,CONFORME O PLANO DE TRABALHO.;7/2/2012;14.000,0
11-80884-5;022S/2011;SES - 25.0001 - SECRETARIA DE ESTADO DA SAÚDE;GRUPO DE APOIO A VIDA - GAV - CAMPINA GRANDE/PB.;6/12/2011;13/12/2011;O PRESENTE CONVÊNIO TEM POR OBJETO MINIMIZAR O IMPACTO PSICOSSOCIAL CAUSADO PELAS DIVERSAS MANIFESTAÇÕES DE PRECONCEITO,DISCRIMINAÇÃO E EXCLUSÃO A QUE SÃO SUBMETIDAS AS PESSOAS VIVENDO COM HIV E AIDS NO SEIO DA SOCIEDADE,ATRAVÉS DA REALIZAÇÃO DE OFICINAS TEMÁTICAS (PRODUÇÃO DE SABER COLETIVO),ACONSELHAMENTOS DE PARES (CONSTRUÇÃO DA AUTONOMIA DOS SUJEITOS) E ACOMPANHAMENTO DOMICILIARES (APOIO PRÁTICO E EMOCIONAL),PERMITINDO OFERECER UM CARÁTER MAIS HUMANIZADO PARA QUE A PESSOA SE SINTA CUIDADA E PERTENCENTE A UMA REDE SOCIAL,CONTRIBUINDO PARA A MELHORIA DA QUALIDADE DE VIDA DAS PESSOAS VIVENDO COM HIV/AIDS,COM O PROJETO CIDADANIA POSITHIVA,CONFORME O PLANO DE TRABALHO.;6/6/2012;35.000,0
11-80882-9;020S/2011;SES - 25.0001 - SECRETARIA DE ESTADO DA SAÚDE;ONG - ESPERANÇA NO AMANHÃ - ENA;6/12/2011;13/12/2011;O PRESENTE CONÊNIO TEM POR OBJETO CONTRIBUIR DE FORMA ELETIVA PARA UMA MELHOR QUALIDADE DE VIDA VIDA DAS CRIANÇAS E ADOLECENTES QUE VIVEM E CONVIVEM COM HIV/AIDS NO ESTADO DA PARAÍBA,ATRAVÉS DO DESENVOLVIMENTO DE AÇÕES QUE POSSIBILITEM CRIANÇAS,ADOLECENTES,SEUS FAMILIARES E CUIDADORES A COMPREENDER E A LIDAR COM SUAS PERCEPÇÕES INDIVIDUAIS E COLETIVAS,TENDO EM VISTA A SUA PARTICIPAÇÃO NA VIDA SOCIAL COMO PROTAGONISTA E ATOR TRANSFORMADOR DA SUA HISTÓRIA,"COM O PROJETO ""CRESCENDO DE BEM COM A VIDA""",CONFORME O PLANO DE TRABALHO.;6/7/2012;35.000,0
11-80875-6;016S/2011;SES - 25.0001 - SECRETARIA DE ESTADO DA SAÚDE;REDE NACIONAL PESQUISA AO VIRUS HIV - AIDS / CAMPINA GRANDE;6/12/2011;10/12/2011;PRESENTE CONVÊNIO TEM POR OBJETO DESENVOLVER AÇÕES DE INTEGRAÇÃO E VALORIZAÇÃO DAS PESSOAS VIVENDO E CONVIVENDO COM HIV/AIDS NO ESTADO DA PARAÍBA,VISANDO CONTRIBUIR PARA A MELHORIA DA QUALIDADE DE VIDA,RESGATE DA AUTOESTIMA E A SOCIALIZAÇÃO DAS PVHA,ALÉM DE PRESTAR ATENDIMENTO JURÍDICO,PSICOSSOCIAL E NUTRICIONAL E MEDIAR CASOS DE VIOLAÇÃO DOS DIREITOS HUMANOS,COM O PROJETO INTEGRAÇÃO E VALORIZAÇÃO,CONFORME O PALNO DE TRABALHO.;6/6/2012;35.000,0
11-80855-1;014S/2011;SES - 25.0001 - SECRETARIA DE ESTADO DA SAÚDE;ONG-CENTRO INFORMATIVO DE PREV. MOBIL,E ACONSELHAMENTO AOS PROFISSIONAIS DO SEXO-CAMPINA GRANDE;25/11/2011;1/12/2011;AMPLIAR E DIFUNDIR AS AÇÕES DE PREVENÇÃO DESENVOLVIDAS PELO CIPMAC NA CIDADE DE CAMPINA GRANDE E OUTROS SEIS MUNICÍPIOS DO INTERIOR DA PARAÍBA - SERRA REDENDA,SOLEDADE,JUAZEIRINHO,POMBAL,MONTEIRO E AREIA - CONTRIBUINDO PARA REDUNÇÃO DOS ÍNDICES DE TRANSMISSÃO DAS DST/HIV/AIDS ENTRE PROFISSIONAIS DO SEXO E CLIENTES.;26/8/2012;35.500,0
11-80838-1;011S/2011;SES - 25.0001 - SECRETARIA DE ESTADO DA SAÚDE;INSTITUTO SOCIAL DE ASSISTÊNCIA À SAÚDE - ISAS;24/10/2011;29/11/2011;CONVÊNIO TEM POR OBJETO GARANTIR A MANUTENÇÃO DO USUÁRIO EM LISTA DE ESPERA,NO STATUS ATIVO,FAVORECENDO MAIOR ACESSO AO TRANSPLANTE RENAL E,CONSEQUENTIMENTE,A REDUÇÃO E AGILIDADE DA LISTA DE ESPERA,GARANTINDO MAIOR EXPERIENCIA E QUALIDADE DE VIDA AO USUÁRIO CRÔNICO RENAL,EM CONSONÂNCIA COM O PLANO DE TRABALHO QUE INTEGRA O PRESENTE CONVÊNIO.;1/10/2016;1.618.496,40
11-80833-1;0480/2011;SEE - 22.0001 - SECRETARIA DE ESTADO DA EDUCAÇÃO;UNIVERSIDADE ESTADUAL DA PARAÍBA;1/11/2011;15/3/2012;BOLSA ESCOLAR AOS ESTUDANTES ALFABETIZADORES VOLUNTÁRIOS E PAGAMENTO DE COORDENADORES LIGADOS AO PLANO ESTADUAL DE ALFABETIZAÇÃO,EXECUTADO ATRAVÉS DO PROGRAMA BRASIL ALFABETIZADO NO ESTADO DA PARAÍBA;28/4/2012;420.000,0
11-80799-7;0424/2011;SEE - 22.0001 - SECRETARIA DE ESTADO DA EDUCAÇÃO;CONSELHO EWCOLAR DA EEEFM MONTE CARMELO - CAMPINA GRANDE/PB.;3/11/2011;11/10/2011;SUPLEMENTAÇÃO DO FORNECIMENTO DE ALIMENTAÇÃO ESCOLAR NA ESCOLA ESTADUAL DE ENSINO FUNDAMENTAL MONTE CARMELO,EM DECORRÊNCIA DO PROJETO PB/VEST.;31/12/2011;7.830,0
11-80788-1;009S/2011;SES - 25.0001 - SECRETARIA DE ESTADO DA SAÚDE;HOSPITAL PEDRO I;10/10/2011;11/11/2011;O PRESENTE CONVÊNIO TEM POR OBJETO GARANTIR A SAÚDE E OS DIREITOS HUMANOS DOS PACIENTES DE FORMA COMPLEMENTAR E ACESSÓRIA AO GOVERNO DO ESTADO DA PARAÍBA,DISPONIBILIZANDO-SE 33 (TRINTA E TRÊS) LEITOS DO HOSPITAL,SENDO 30 (TRINTA) LEITOS GERAIS PARA ATENDER PACIENTES PORTADORES DE MOLÉSTIAS CLÍNICAS DE MÉDIA COMPLEXIDADE E 03 (TRÊS) LEITOS DE UTI PARA ATENDER PACIENTES GRAVES PORTADORES DE MOLÉSTIAS CRÔNICAS DE LONGA PERMANÊNCIA HOSPITALAR (DOENÇAS NEUROLÓGICAS E INFECTO-CONTAGIOSA),TODOS ORIUNDOS E EGRESSOS DO HOSPITAL DE EMERGÊNCIA E TRAUMA DOM LUIZ GONZAGA,AMPLIANDO A CAPACIDADE INSTALADA DE LEITOS GERAIS E DE UTI,EM CONSONÂNCIA COM O PLANO DE TRABALHO E DEMAIS ANEXOS QUE INTEGRAM O PRESENTE CONVÊNIO,INDEPENDENTEMENTE DE TRANSCRIÇÃO.;10/10/2012;0,0
11-80760-1;0021/2011;FUNCEP - 20.901 - FUNDO DE COMBATE E ERRADICAÇÃO À POBREZA DO ESTADO;ORGANIZAÇÃO PAPEL MARCHE - PAPEL MARCHE / CAMPINA GRANDE;24/10/2011;4/11/2011;MANUTENÇÃO DA INSTITUIÇÃO QUE ATENDE CRIANÇAS E ADOLESCENTES CARENTES NO CONTRA TURNO ESCOLAR E SEUS FAMILIARES.;30/9/2012;112.080,0
11-80567-6;0007/2011;SEAP - 24.0001 - SECRETARIA DE ESTADO DE ADMINISTRAÇÃO PENITENCIÁRIA;SERVIÇO NACIONAL DA INDUSTRIA - SENAI / CAMPINA GRANDE/PB.;29/8/2011;8/10/2011;REALIZAÇÃO DE CURSOS DE CAPACITAÇÃO,PARA REINTEGRAÇÃO SOCIAL DE SENTENCIADOS.;25/2/2013;0,0
11-80495-5;0018/2011;FUNCEP - 20.901 - FUNDO DE COMBATE E ERRADICAÇÃO À POBREZA DO ESTADO;INSTITUTO SÃO VICENTE DE PAULO / CAMPINA GRANDE;14/9/2011;21/9/2011;ASSISTÊNCIA AOS IDOSOS INTERNOS,ATRAVÉS DA ALIMENTAÇÃO,HIGIENE E LIMPEZA,ALÉM DE CUIDADO MÉDICO.;28/2/2013;157.500,0
11-80470-0;0001/2011;PROCON - 09.203 - PROCON/PB - PROTEÇÃO E DEFESA DO CONSUMIDOR DO ESTADO DA PARÍBA;UNIÃO DE ENSINO SUPERIOR DE CAMPINA GRANDE;11/8/2011;2/9/2011;EXECUÇÃO DA POLÍTICA DE PROTEÇÃO E DEFESA DO CONSUMIDOR NO ESTADO DA PARAÍBA,COM A CRIAÇÃO E INSTALAÇÃO DO SISTEMA MUNICIPAL DE PROTEÇÃO E DEFESA DO CONSUMIDOR - SMDC NO BAIRRO DO CENTRO NO MUNICÍPIO DE CAMPINA GRANDE -PB,DENTRO DAS DIRETRIZES CONTIDAS NA LEI FEDERAL Nº 8.078 DE 11 DE SETEMBRO DE 1990 - CÓDIGO DE DEFESA DO CONSUMIDOR NO DECRETO FEDERAL Nº 2.181 DE 20 DE MARÇO DE 1997,CUMPRINDO A POLÍTICA ESTADUAL DE DEFSA DO CONSUMIDOR NO ESTADO DA PARAÍBA.;11/8/2015;0,0
11-80354-1;0006/2011;SES - 25.0001 - SECRETARIA DE ESTADO DA SAÚDE;REDE NACIONAL PESQUISA AO VIRUS HIV - AIDS / CAMPINA GRANDE;25/7/2011;5/8/2011;PRESTAR ASSISTÊNCIA ÀS PESSOAS PORTADORAS QUE VIVEM E/OU CONVIVEM COM HIV/AIDS,ATRAVÉS DO PROJETO CASA DE APOIO CÉLIA BRECHÓ,EM CONSONÂNCIA COM O PLANO DE TRABALHO QUE INTEGRA O CONVÊNIO INDEPENDENTEMENTE DE TRANSCRIÇÃO.;30/7/2013;114.240,0
11-80323-1;0004/2011;SES - 25.0001 - SECRETARIA DE ESTADO DA SAÚDE;CENTRO ELOHIM DE EQUOTERAPIA E HIPISMO - CEEQ;22/7/2011;29/7/2011;O PRESENTE CONVÊNIO TEM POR OBJETO A MANUTENÇÃO DO CENTRO ELOHIM DE EQUOTERAPIA E HIPISMO - CEEQ  CAMPINA GRANDE,NESTE ESTADO,EM CONSONÂNCIA COM O PLANO DE TRABALHO QUE INTEGRA O CONVÊNIO INDEPENDENTEMENTE DE TRANSCRIÇÃO.;1/8/2016;1.078.870,64
11-80314-2;0003/2011;SES - 25.0001 - SECRETARIA DE ESTADO DA SAÚDE;ONG - ESPERANÇA NO AMANHÃ - ENA;8/7/2011;28/7/2011;PRESTAR ASSISTÊNCIA AS PESSOAS PORTADORAS QUE VIVEM E/OU CONVIVEM HIV/AIDS,"ATRAVÉS DO PROJETO ""CRESCENDO DE BEM COM A VIDA - 2010"" APROVADO PELO PAM - PROGRAMA DE AÇÕES E METAS - ESTADUAL/2010",EM CONSONÂNCIA COM O PLANO DE TRABALHO QUE INTEGRA O CONVÊNIO INDEPENDENTEMENTE DE TRANSCRIÇÃO.;30/3/2013;8.000,0
11-80262-6;0008/2011;FUNCEP - 20.901 - FUNDO DE COMBATE E ERRADICAÇÃO À POBREZA DO ESTADO;FUNDAÇÃO ASSISTENCIAL DA PARAÍBA  -  FAP;7/6/2011;7/7/2011;AQUISIÇÃO DE MEDICAMENTOS PARA PACIENTES ACOMETIDOS OU PORTADORES DE CÂNCER EM TRATAMENTO QUIMIOTERÁPICO.;31/3/2013;990.000,0
11-80248-1;0002/2011;EMEPA - 32.202 - EMPRESA ESTADUAL DE PESQUISA AGROPECUÁRIA DA PARAÍBA;UNIVERSIDADE ESTADUAL DA PARAÍBA;30/6/2011;2/7/2011;IMPLANTAR AÇÕES TECNOLÓGICAS NO CENTRO DE CIÊNCIAS HUMANAS E NA ESCOLA AGROTÉCNICA DO CAJUEIRO,COM VISTAS AO INTERCÂMBIO DE CONHECIMENTOS EM ÁREAS ESPECÍFICAS DO DOMÍNIO DAS INSTITUIÇÕES,COMO FORMA DE PROMOVER O DESENVOLVIMENTO SUSTENTÁVEL DO SEMI-ÁRIDO PARAIBANO. ;30/6/2015;0,0
11-80239-1;0010/2011;FUNCEP - 20.901 - FUNDO DE COMBATE E ERRADICAÇÃO À POBREZA DO ESTADO;ASSOC. DE PAIS E AMIGOS EXEPICIONAIS DE CAMPINA GRANDE;8/6/2011;28/6/2011;MANUTENÇÃO DA INSTITUIÇÃO QUE PRESTA SERVIÇO ASSISTENCIAL DE SAÚDE,EDUCACIONAL,CULTURAL,E OUTROS,A 420 PESSOAS COM DEFICIÊNCIA.;31/12/2012;94.500,2
"11-80225-1;0006/2011;SETDE - 21.0001 - SECRETARIA DE ESTADO DO TURISMO E DESENVOLVIMENTO ECONÔMICO;CÂMERA DIRIGENTES LOJISTAS - CDL / CAMPINA GRANDE;13/6/2011;16/6/2011;PARTICIPAÇÃO DA SETDE NA CAMPANHA ""LIQUIDA CAMPINA 2011"". QUE REALIZAR-SE-Á NO MUNICIPIO DE CAMPINA GRANDE/PB.;30/11/2011;100.000,0
11-80204-9;0007/2011;FUNCEP - 20.901 - FUNDO DE COMBATE E ERRADICAÇÃO À POBREZA DO ESTADO;CASA DE ACOLHIDA SÃO PAULO DA CRUZ;4/5/2011;11/6/2011;MANUTENÇÃO,VISANDO MELHORAR O ATENDIMENTO ÀS PESSOAS CARENTES ASSISTIDAS NA INSTITUIÇÃO.;28/2/2013;110.643,75
11-80179-4;0011/2011;FUNCEP - 20.901 - FUNDO DE COMBATE E ERRADICAÇÃO À POBREZA DO ESTADO;CONGREGAÇÃO REDENTORISTA NORDESTINA;4/5/2011;1/6/2011;ASSISTÊNCIA EDUCACIONAL DE 277 JOVENS CARENTES,ATRAVÉS DE CURSOS PROFISSIONALIZANTES NAS ÁREAS DE ELETRÔNICA,TELECOMUNICAÇÕES,INFORMÁTICA,LOGÍSTICA,ENFERMAGEM,SEGURANÇA DO TRABALHO,EQUIPAMENTOS BIOMÉDICOS E GUIA TURÍSTICO.;31/12/2011;1.030.440,0
11-80177-8;0009/2011;FUNCEP - 20.901 - FUNDO DE COMBATE E ERRADICAÇÃO À POBREZA DO ESTADO;CASA DO MENINO / CAMPINA GRANDE;4/5/2011;31/5/2011;ATENDER AS CRIANÇAS E OS ADOLESCENTES,EM REGIME DE SEMI-INTERNATO,PROVINDAS DE FAMÍLIAS QUE VIVEM PRATICAMENTE ABAIXO DA POBREZA.;28/2/2013;122.608,50
11-80176-0;0006/2011;FUNCEP - 20.901 - FUNDO DE COMBATE E ERRADICAÇÃO À POBREZA DO ESTADO;CASA DE CARIDADE PADRE IBIAPINA;4/5/2011;31/5/2011;MANUTENÇÃO DO PROGRAMA DE ATENDIMENTO DE CRIANÇAS E ADOLESCENTES VIVENDO EM SITUAÇÃO DE RISCO SOCIAL E PESSOAL,SEMI-INTERNAS NA INSTITUIÇÃO.;30/4/2013;75.600,0
11-80170-1;0004/2011;FUNCEP - 20.901 - FUNDO DE COMBATE E ERRADICAÇÃO À POBREZA DO ESTADO;CENTRO DE RECUPERAÇÃO HOMENS DE CRISTO / CAMPINA GRANDE;4/5/2011;27/5/2011;TRATAR E ASSISTIR DEPENDENTES QUÍMICOS DE ÁLCOOL E OUTRAS DROGAS,DO SEXO MASCULINO,COM FAIXA ETÁRIA DOS 18 AOS 70 ANOS,EM REGIME DE INTERNATO,AJUDANDO A INTEGRÁ-LOS À FAMÍLIA E À SOCIEDADE.;31/12/2012;126.000,0
11-80152-2;0005/2011;FUNCEP - 20.901 - FUNDO DE COMBATE E ERRADICAÇÃO À POBREZA DO ESTADO;CASA DA CRIANÇA DR. JOÃO MOURA / CAMPINA GRANDE;4/5/2011;14/5/2011;ASSISTÊNCIA ÀS CRIANÇAS CARENTES EM REGIME DE SEMI-INTERNATO (ABRIGO ABERTO) E ASSISTÊNCIA ÀS FAMÍLIAS E AS MÃES DAS CRIANÇAS.;31/7/2012;136.500,0
11-80129-8;0002/2011;PM/PB - 15.0001 - POLICIA MILITAR DO ESTADO DA PARAIBA;FUNDAÇÃO UNIVERSITÁRIA DE APOIO AO ENSNIO,PESQUISA E EXTENSÃO - FURNE;8/4/2011;3/5/2011;PARCERIA TÉCNICO-PEDAGÓGICA OPERACIONAL ENTRE AS CONVENENTES NA REALIZAÇÃO DO PROCESSO SELETIVO INTERNO PARA O CURSO DE FORMAÇÃO DE SARGENTOS DA POLÍCIA MILITAR DA PARAÍBA E PARA O CURSO DE FORMAÇÃO DE SARGENTOS DO CORPO DE BOMBEIROS MILITAR DA PARAÍBA.;8/4/2016;0,0
11-80119-1;0002/2011;DPE - 14.0001 - DEFENSORIA PÚBLICA DO ESTADO DA PARAIBA;UNIVERSIDADE ESTADUAL DA PARAÍBA;26/4/2011;28/4/2011;FORMALIZAÇÃO DAS CONDIÇÕES ESSENCIAIS À CRIAÇÃO DO NÚCLEO ACADÊMICO DE ESTUDOS JURÍDICOS,COM A PARTICIPAÇÃO DE ESTUDANTES DOS CURSOS DE DIREITO DA UEPB,DEVIDAMENTE MATRICULADOS A PARTIR DO 7º PERÍODO,DE PROFESSORES DA IES PARTICIPANTE,DEVIDAMENTE DESIGNADOS PARA TAL FIM E DE DEFENSORES PÚBLICOS,IGUALMENTE INDICADOS PELA CONCEDENTE.;26/4/2015;0,0
11-80105-1;0133/2011;SEE - 22.0001 - SECRETARIA DE ESTADO DA EDUCAÇÃO;PREFEITURA MUNICIPAL DE CAMPINA GRANDE;7/4/2011;21/4/2011;CUSTEAR O TRANSPORTE DE ALUNOS RESIDENTES EM ÁREAS RURAIS PARA AS ESCOLAS DA REDE ESTADUAL DE ENSINO DA ZONA URBANA.;31/12/2011;505.000,0
11-80067-4;0001/2011;IMEQ - 21.0401 - INSTITUTO DE METROLOGIA E QUALIDADE DA PARAÍBA;UNIVERSIDADE ESTADUAL DA PARAÍBA;4/4/2011;8/4/2011;CONSTITUI OBJETO DESTE CONVÊNIO Nº.001/2011,ESTABELECER CONDIÇÕESINDISPENSÁVEIS A VIABILIZAÇÃO DE COCESSÃO DE ESTÁGIOS CURRICULARES A ESTUDANTES DA UNIVERSIDADE ESTADUAL DA PARAÍBA - UEPB,REGULARMENTE MATRICULADOS E COM EFETIVA FREQUÊNCIA,ENTENDIDO COMO UM ATO EDUCATIVO ESCOLAR SUPERVISIONADO E COMO UMA ESTRATÉGIA DE PROFISSIONALIZAÇÃO QUE COMPLEMENTE O PROCESSO ENSINO APRENDIZAGEM.     ;2/4/2015;0,0
11-80065-8;0002/2011;UEPB - 22.0401 - UNIVERSIDADE ESTADUAL DA PARAÍBA;HOSPITAL PEDRO I;24/3/2011;8/4/2011;ESTABELECER CONDIÇÕES INDISPENSÁVEIS À VIABILIZAÇÃO DE CONCESSÃO DE ESTÁGIOS CURRICULARES OBRIGATÓRIOS PARA ALUNOS REGULARMENTE MATRICULADOS E COM EFETIVA FREQÜÊNCIA NO(S) CURSO(S) DE GRADUAÇÃO EM FARMÁCIA,ENFERMAGEM E FISIOTERAPIA MINISTRADOS PELA UEPB.;24/3/2014;0,0
11-80058-5;0005/2011;DETRAN - 26.0101 - DEPARTAMENTO ESTADUAL DE TRÂNSITO DO ESTADO DA PARAÍBA;SINDICATO DOS MOTOTAXISTAS E ENTREGADORES DE ENCOMENDAS EM MOTOCICLETAS E SIMILARES DE CG-SINDMOTO;22/2/2011;5/4/2011;REPASSE DA CONTRIBUIÇÃO SINDICAL DEVIDA PELOS INTEGRANTES DAS CATEGORIAS PROFISSIONAIS REPRESENTADAS PELO SINDMOTO-CG,SENDO TAL CONTRIBUIÇÃO ACRESCIDA AO MONTANTE A SER PAGO POR OCASIÃO DO LICENCIAMENTO DOS VEÍCULOS DE TRANSPORTES DE PASSAGEIROS E ENCOMENDAS EM MOTOCICLETAS NA CATEGORIA ALUGUEL.;21/2/2012;60,0
11-80005-4;0005/2011;IMEQ - 21.0401 - INSTITUTO DE METROLOGIA E QUALIDADE DA PARAÍBA;UNESC- UNIÃO DE ENSINO SUPERIOR- CAMPINA GRANDE;28/2/2011;3/3/2011;CONSTITUI OBEJTO DESTE INSTRUMENTO DO CONVÊNIO,ESTABELECER CONDIÇÕES INDISPENSAVEIS A VIABILIZAÇÃO DE CONCESSÃO DE ESTÁGIOS CURRICULARES AOS ESTUDANTES DA UNESC - UNIÃO DE ENSINO SUPERIOR DE CAMPINA GRANDE/PB,REGULARMENTE MATRICULADOS E COM EFETIVA FREQUENCIA,ENTENDIDO COMO UM ATO EDUCATIVO ESCOLAR SUPERVISIONADO E COMO UMA ESTRATÉGICA DE PROFISSIONALIZAÇÃO QUE COMPLEMENTE O PROCESSO ENSINO-APRENDIZAGEM.;27/2/2015;0,0
10-80784-5;0036/2010;FUNCEP - 20.901 - FUNDO DE COMBATE E ERRADICAÇÃO À POBREZA DO ESTADO;CASA DO MENINO / CAMPINA GRANDE;16/12/2010;18/12/2010;REFORMA NAS INSTALAÇÕES DO PRÉDIO DA CASA DO MENINO,LOCALIZADO NO MUNICÍPIO DE CAMPINA GRANDE-PB.;31/5/2011;60.387,43
"10-80759-4;0001/2010;SEINTER - 18.0001 - SECRETARIA DO ESTADO DA INTERIORIZAÇÃO DA AÇÃO DO GOVERNO;PREFEITURA MUNICIPAL DE CAMPINA GRANDE;13/12/2010;17/12/2010;REPASSAR RECURSOS FINANCEIROS VISANDO APOIAR A REALIZAÇÃO DO EVENTO DENOMINADO ""NATAL DOS SONHOS 2010"" NA CIDADE DE CAMPINA GRANDE.;12/2/2011;378.840,0
10-80753-5;0035/2010;FUNCEP - 20.901 - FUNDO DE COMBATE E ERRADICAÇÃO À POBREZA DO ESTADO;ORGANIZAÇÃO PAPEL MARCHE - PAPEL MARCHE / CAMPINA GRANDE;1/12/2010;4/12/2010;MANUTENÇÃO DA ORGANIZAÇÃO PAPEL MARCHÊ,QUE ATENDE 81 (OITENTA E UMA) CRIANÇAS E ADOLESCENTES PORTADORES DE NECESSIDADES ESPECIAIS.;31/10/2011;61.557,30
10-80729-2;012//2010;DETRAN - 26.0101 - DEPARTAMENTO ESTADUAL DE TRÂNSITO DO ESTADO DA PARAÍBA;SINDICATO DOS MOTOTAXISTAS E ENTREGADORES DE ENCOMENDAS EM MOTOCICLETAS E SIMILARES DE CG-SINDMOTO;4/8/2010;1/10/2010;O PRESENTE CONVÊNIO TEM POR OBJETO O REPASSE AO SINDICATO DA CONTRIBUIÇÃO SINDICAL ANUAL;3/8/2011;0,0
10-80724-1;0007/2010;SEAP - 24.0001 - SECRETARIA DE ESTADO DE ADMINISTRAÇÃO PENITENCIÁRIA;UNIVERSIDADE ESTADUAL DA PARAÍBA;4/9/2010;28/9/2010;O PRESENTE CONVÊNIO TEM POR OBJETO,A PRESTAÇÃO DE MÃO-DE-OBRA PRISIONAL FORNECIDA POR REEDUCANDOS DO SISTEMAS PENITENCIÁRIO DO ESTADO DA PARAIBA,QUE SE ENCONTREM CUMPRINDO PENA EM REGIME ABERTO,SEMI-ABERTO E EM LIVRAMENTO CONDICIONAL,DECRETADOS PELA JUSTIÇA CRIMINAL,PREVISTA NA FORMA DA LEI,COM O OBJETIVO D EPROMOVER A REINTEGRAÇÃO SOCIAL DOS MESMOS,COMO DEVER SOCIAL,ELEVAÇÃO DA DIGNIDADE HUMANA A CARÁTER EDUCATIVO E PRODUTIVO,SEM VÍNCULO EMPREGATICIO,NOS LOCAIS E DEPENDÊNCIAS DA CONVENENTE.;4/9/2015;1.961.685,0
10-80708-0;0002/2010;SER - 17.0001 - SECRETARIA DE ESTADO DA RECEITA;UNIVERSIDADE ESTADUAL DA PARAÍBA;1/9/2010;11/9/2010;PROGRAMA DE MÚTUA COOPERAÇÃO TÉCNICO CIENTÍFICA ENTRE OS CONVENENTES. ;31/8/2018;0,0
10-80693-8;0002/2010;FAC - 27.0202 - FUNDAÇÃO DE AÇÃO COMUNITÁRIA;UNIVERSIDADE ESTADUAL DA PARAÍBA;1/7/2010;25/8/2010;CONTRATAÇÃO DE ESTAGIOS CURRICULARES OBRIGATORIOS;1/7/2012;88.360,80
10-80631-8;0030/2010;SEPLAG - 20.101 - SECRETARIA DE ESTADO DE PLANEJAMENTO,ORÇAMENTO,GESTÃO E FINANÇAS;COOP. PRODUTORES TÊXTIL  ALGODÃO COLORIDO DA PARAÍBA;28/6/2010;17/7/2010;PROJETO PRODUTIVO APL DO ALGODÃO ECOLOGICO.;23/2/2015;481.610,70
10-80598-2;0006/2010;CINEP - 21.0101 - CIA DE DESENVOLVIMENTO DA PARAÍBA;CENTRO DE ENSINO SUPERIOR E DESENVOLVIMENTO LTDA / CAMPINA GRANDE;1/10/2010;5/11/2010;VIABILIZAÇÃO DE CONCESSÃO DE ESTÁGIOS,PELA CONCEDENTE AOS ESTUDANTES DA CONVENENTE,REGULARMENTE MATRICULADOS EM ESTÁGIOS SUPERVISIONADOS E COM EFETIVA FREQUÊNCIA NOS CURSOS DE GRADUAÇÃO DO CESED,ENTENDIDO O ESTÁGIO COMO UMA ESTRATÉGIA DE PROFISSIONALIZAÇÃO QUE COMPLEMENTE O PROCESSO ENSINO/APRENDIZAGEM MEDIANTE PLANO DE TRABALHO,QUE INTEGRARÁ ESTE INSTRUMENTO INDEPENDENTEMENTE DE TRANSCRIÇÃO.;1/10/2012;0,0
10-80551-6;0035/2010;SES - 25.0001 - SECRETARIA DE ESTADO DA SAÚDE;REDE NACIONAL PESQUISA AO VIRUS HIV - AIDS / CAMPINA GRANDE;1/7/2010;2/7/2010;PRESTAR ASSISTENCIA AS PESSOAS PORTADORAS QUE VIVEM E/OU CONVIVEM COM HIV/AIDS,ATRAVES DO PROJETO CASA DE APOIO CELIA BRECHO,APROVADO PELO PAM - PROGRAMA DE AÇÕES E METAS - ESTADUAL 2010 EM COSONANCIA COM O PLANO DE TRABALHO.;1/7/2011;93.414,0
10-80526-5;0178/2010;SEE - 22.0001 - SECRETARIA DE ESTADO DA EDUCAÇÃO;CONSELHO DA EEEF MONTE SANTO;29/6/2010;2/7/2010;CUSTEAR O TRANSPORTE ESCOLAR PARA ALUNOS RESIDENTES EM AREAS RURAIS MATRICULADOS NAS ESCOLAS DA ZONA URBANA.;31/12/2010;51.600,0
10-80510-9;0030/2010;SES - 25.0001 - SECRETARIA DE ESTADO DA SAÚDE;REDE NACIONAL PESQUISA AO VIRUS HIV - AIDS / CAMPINA GRANDE;22/6/2010;2/7/2010;  PRESTAR ASSISTÊNCIA ÀS PESSOAS PORTADORA QUE VIVEM E CONVIVEM E/OU CONVIVEM COM HIV/AIDS,"ATRAVES DO PROJETO ""MERCADO DE TRABALHO E QUALIFICAÇÃO PROFISSIONAL 2010",APROVADO PELO PAM - PROGRAMA DE AÇÕES E METAS - ESTADUAL/2010,EM CONSONÂNCIA COM O PLANO DE TRABALHO QUE INTEGRA O CONVÊNIO INDEPENDENTEMENTE DE TRANSCRIÇÃO.;22/1/2011;35.500,0
10-80509-5;0029/2010;SES - 25.0001 - SECRETARIA DE ESTADO DA SAÚDE;REDE NACIONAL PESQUISA AO VIRUS HIV - AIDS / CAMPINA GRANDE;22/6/2010;2/7/2010; MANTER APOIO AS PESSOAS INFECTADAS PELO HIV/AIDS E FAMILIARES,EM CAMPINA GRANDE,EM ATENDIMENTO AO PROJETO ESTRATÉGICO COM APROVADO PELO PAM - PROGRAMA DE AÇÕES E METAS - ESTADUAL/2010,EM CONSONÂNCIA COM O PLANO DE TRABALHO QUE INTEGRA O CONVÊNIO INDEPENDENTEMENTE DE TRANSCRIÇÃO.;22/8/2010;8.000,0
10-80508-7;0033/2010;SES - 25.0001 - SECRETARIA DE ESTADO DA SAÚDE;ONG - ESPERANÇA NO AMANHÃ - ENA;28/6/2010;2/7/2010;PRESTAR ASSISTÊNCIA AS PESSOAS PORTADORAS QUE VIVEM E/OU CONVIVEM COM HIV/AIDS,ATRAVÉS DO PROJETO DE BEM COM A VIA - 2010,APROVADO PELO PAM - PROGRAMA DE AÇÕES E METAS - ESTADUAL 2010,EM CONSONÂNCIA COM O PLANO DE TRABALHO.;28/1/2011;35.500,0
10-80474-9;0232/2010;SEE - 22.0001 - SECRETARIA DE ESTADO DA EDUCAÇÃO;CONSELHO DA EEEF JOAQUINA CABRAL;18/6/2010;2/7/2010;CUSTEAR O TRANSPORTE ESCOLAR DE ALUNOS RESIDENTES EM ÁREAS RURAIS PARA AS ESCOLAS DA ZONA URBANA.;31/12/2010;80.000,0
10-80459-5;0233/2010;SEE - 22.0001 - SECRETARIA DE ESTADO DA EDUCAÇÃO;CONSELHO ESCOLAR DA EEEFM JOSÉ MIGUEL LEÃO - CAMPINA GRANBDE/PB.;18/6/2010;29/6/2010;CUSTEAR O TRANSPORTE ESCOLAR DE ALUNOS RESIDENTES EM ÁREAS RURAIS PARA AS ESCOLAS DA ZONA URBANA.;31/12/2010;80.000,0
10-80458-7;0230/2010;SEE - 22.0001 - SECRETARIA DE ESTADO DA EDUCAÇÃO;CONSELHO DA EEEFM ANTÔNIO GUEDES DE ANDRADE;18/6/2010;2/7/2010;CUSTEAR O TRANSPORTE ESCOLAR DE ALUNOS RESIDENTES EM ÁREAS RURAIS PARA AS ESCOLAS DA ZONA URBANA.;31/12/2010;80.000,0
10-80451-0;0013/2010;SES - 25.0001 - SECRETARIA DE ESTADO DA SAÚDE;ONG - ESPERANÇA NO AMANHÃ - ENA;16/3/2010;22/6/2010; PRSTAR ASSISTÊNCIA AS PESSOAS PORTADORAS QUE VIVEM E/OU CONVIVEM HIV E AIDS EM CONSONÂNCIA COM OPLANO DE TRABALHO QUE INTEGRA O CONVÊNIO INEPENDENTEMENTE DE TRANSCRIÇÃO. ;16/3/2011;7.500,0
10-80446-3;0024/2010;SES - 25.0001 - SECRETARIA DE ESTADO DA SAÚDE;CENTRO ELOHIM DE EQUOTERAPIA E HIPISMO - CEEQ;8/6/2010;22/6/2010;MANUTENÇÃO DO CENTRO ELOHIM DE EQUOTERAPIA E HIPISMO,NA CIDADE DE CAMPINA GRANDE/PB. ;7/6/2011;132.600,0
10-80442-1;0180/2010;SEE - 22.0001 - SECRETARIA DE ESTADO DA EDUCAÇÃO;CONSELHO ESCOLAR MARIA AUGUSTA LUCENA BRITO / CAMPINA GRANDE;14/6/2010;18/6/2010;CUSTEAR O TRANSPORTE ESCOLAR DE ALUNOS RESIDENTES EM ÁREAS RURAIS PARA AS ESCOLAS DA ZONA RUBANA.;31/12/2010;79.500,0
10-80431-5;0179/2010;SEE - 22.0001 - SECRETARIA DE ESTADO DA EDUCAÇÃO;CONSELHO ESCOLAR RUBENS DUTRA SEGUNDO /CAMPINA GRANDE;14/6/2010;18/6/2010;CUSTEAR O TRANSPORTE ESCOLAR DE ALUNOS RESIDENTES EM ÁREAS RURAIS PARA AS ESCOLAS DA ZONA URBANA.;31/12/2010;80.000,0
10-80411-1;0181/2010;SEE - 22.0001 - SECRETARIA DE ESTADO DA EDUCAÇÃO;CONSELHO ESCOLAR WALNIZA BORBOREMA CUNHA LIMA - CAMPINA GRANDE/PB.;14/6/2010;17/6/2010;CUSTEAR O TRANSPORTE ESCOLAR DE ALUNOS RESIDENTES EM ÁREAS RURAIS PARA AS ESCOLAS DA ZONA URBANA.;31/12/2010;68.500,0
10-80370-0;0012/2010;FUNCEP - 20.901 - FUNDO DE COMBATE E ERRADICAÇÃO À POBREZA DO ESTADO;INSTITUTO SÃO VICENTE DE PAULO / CAMPINA GRANDE;7/6/2010;10/6/2010;AQUISIÇÃO DE MAQUINÁRIO PROFISSIONAL PARA LAVANDERIA DO INSTITUTO.;31/7/2010;115.122,0
10-80369-6;0009/2010;FUNCEP - 20.901 - FUNDO DE COMBATE E ERRADICAÇÃO À POBREZA DO ESTADO;CASA DE ACOLHIDA SÃO PAULO DA CRUZ;7/6/2010;10/6/2010;MANUTENÇÃO DA INSTITUIÇÃO.;31/1/2011;78.750,0
10-80365-3;0015/2010;FUNCEP - 20.901 - FUNDO DE COMBATE E ERRADICAÇÃO À POBREZA DO ESTADO;FUNDAÇÃO ASSISTENCIAL DA PARAÍBA  -  FAP;2/6/2010;9/6/2010;AQUISIÇÃO DE MEDICAMENTOS PARA PACIENTES ACOMETIDOS OU PORTADORES DE CÂNCER EM TRATAMENTO QUIMIOTERÁPICO.;31/7/2011;630.000,0
10-80363-7;0004/2010;JUCEP - 21.0501 - JUNTA COMERCIAL DO ESTADO DA PARAÍBA;UNIVERSIDADE ESTADUAL DA PARAÍBA;1/6/2010;8/6/2010;CONCESSÃO DE ESTAGIO CURRICULAR ;31/5/2012;0,0
